,topic,file,text
0,Emotion,HeroPoemsNedKellyWasAHeroPoembyFrancisDuggan,"Ned Kelly was a hero and despite what some do say
The legend of his bravery in Australia lives today
As game as Ned Kelly is a well known Aussie quote
The leader of the Kelly gang remains as one of note.
The Kelly gang were victims of unfair local law
And the raping of his sister Kate by the police was surely the last straw
Ned and his brother Dan and their friends Steve Hart and Joe Byrne became outlaws and they ranged far and wide
And they robbed banks in the small Towns of Victoria-New South Wales border Countryside.
The most recognizable Australian in Australia's brief white history
His unfair trial and his hanging in Melbourne jail assured him of immortality
Though far better people than them are long forgotten and gone
The legend of the Kelly gang is with us and lives on.
The Kelly gang were not as ruthless as some make them out to be
They may have caused the deaths of a few Policemen but even those with anti Kelly views agree
That there was some provocation the Kelly gang was on the run
And you shoot back when you are shot at that is the law of the gun.
Ned Kelly is a hero and 'tis said that he died game
And in Australian folklore his is an immortal name
And whatever way you see him on one thing all do agree
That the legend of the Kelly gang lives on in Aussie history."
1,Emotion,HeroPoemsMyHeroPoembyMichaelPJohnson,"Jesus my Hero God & man
My Lord who’s never far
I salute You because I can
And who in truth You are
What so many consider odd
Contra what fools may say
There really is an awesome God
Through love to show The Way
The Way to love to endless bliss
Beyond this world of fears
To a life far greater than this
In a Land free of tears
He is my strength my trusted shield
My fortress and my sword
Now to the foe I’ll never yield
My Hero is The Lord
A precious God a wondrous King
A Hero born to free
Who’s praises forever I’ll sing
For saving such as me
With hands aloft with head held high
With eyes watching above
Together my Hero and I
Will show my neighbours love
Surely my Hero I salute
For giving me His hand
That I may bear my Saviour fruit
Towards His Promised Land
Perhaps these eyes may soon grow dim
I’ll trust who is my friend
Should I wonder seeing in Him?
My Hero to the end"
2,Emotion,HeroPoemsTheHeroPoembySiegfriedSassoon,"'Jack fell as he'd have wished,' the mother said,
And folded up the letter that she'd read.
'The Colonel writes so nicely.' Something broke
In the tired voice that quavered to a choke.
She half looked up. 'We mothers are so proud
Of our dead soldiers.' Then her face was bowed.
Quietly the Brother Officer went out.
He'd told the poor old dear some gallant lies
That she would nourish all her days, no doubt
For while he coughed and mumbled, her weak eyes
Had shone with gentle triumph, brimmed with joy,
Because he'd been so brave, her glorious boy.
He thought how 'Jack', cold-footed, useless swine,
Had panicked down the trench that night the mine
Went up at Wicked Corner; how he'd tried
To get sent home, and how, at last, he died,
Blown to small bits. And no one seemed to care
Except that lonely woman with white hair."
3,Emotion,HeroPoemsLetMeBeYourHeroPoembyJoHannaErk,"Let Me Be Your HERO
By: Jo E
My daughter, let me be your Hero.
Let me take you hand and lead you into a dance.
Let me look at you and take you in my arms.
Dance with me in the Rain.
But most of all my daughter 'Let me be you Hero'
Let me show you how much you are loved.
Let me show you how much I LOVE YOU.
Let me just protect you.
But most of all, will you Let me be YOUR  HERO
Let me be YOUR HERO
Take my hand, and i will lead you.
I will lead you to the most beautiful, wonderful, magic place where its just you and me!
Let me be Your HERO
I will take you hand in mine and never let go
Let me be YOUR HERO
I will love you till eternity
Let me be YOU HERO
Let me hold you in my arms where u just want to cry
Let me be YOUR HERO
I wil protect you, when there is no one to protect you. Ill BE YOUR HERO!
WIll you just let me be you HERO?
My Daughter ILL be YOUR HERO if only you will LET ME BE YOUR HERO!
©2009"
4,Emotion,HeroPoemsmyHeroAStoryPoembyWalterBurlock,"When I was a little kid about 7 or 8 years old there was this girl. She was a lot older then me. She took care of me when my foster mother and father had a break. She was really caring and polite. I was really fussy but she got me what ever I needed. She showed me there is good out there. So I tried being like her. There was one time she let me steer her car, she still had control of the gas and the brake, I thought it was the coolest thing. When I grew up I noticed when you had no control over anything, you can have control for just a little at a time. You start to know your mistakes. When I was steering that car I was swerving, but I had her to correct my mistakes. Her correcting them for me while I was by her side, I learned it a lot faster then I would of on my own. Now we aren't that close to each other, and I started to forget what she taught me that one day. I didn't like how I was treating other people and I thought about stuff to be a better person.  I thought and thought about it and I remembered what she did for me. I was changing a little at a time. There was a lot more then what I  wrote in this story. I don't know how to thank her, maybe this story will do more than I think. Thank You for being my hero."
5,Emotion,HeroPoemsToHermannStoffkraftPhDTheHeroOfARecentWorkCalledParadoxicalPhilosophyPoembyJamesClerkMaxwell,"A paradoxical ode, after Shelley.
I.
My soul is an entangled knot,
Upon a liquid vortex wrought
By Intellect, in the Unseen residing,
And thine cloth like a convict sit,
With marlinspike untwisting it,
Only to find its knottiness abiding;
Since all the tools for its untying
In four-dimensioned space are lying
Wherein thy fancy intersperses
Long avenues of universes,
While Klein and Clifford fill the void
With one finite, unbounded homaloid,
And think the Infinite is now at last destroyed.
II.
But when thy Science lifts her pinions
In Speculation’s wild dominions,
We treasure every dictum thou emittest,
While down the stream of Evolution
We drift, expecting no solution
But that of the survival of the fittest.
Till, in the twilight of the gods,
When earth and sun are frozen clods,
When, all its energy degraded,
Matter to æther shall have faded;
We, that is, all the work we’ve done,
As waves in æther, shall for ever run
In ever-widening spheres through heavens beyond the sun.
III.
Great Principle of all we see,
Unending Continuity!
By thee are all our angles sweetly rounded,
By thee are our misfits adjusted,
And as I still in thee have trusted,
So trusting, let me never be confounded!
Oh never may direct Creation
Break in upon my contemplation;
Still may thy causal chain, ascending,
Appear unbroken and unending,
While Residents in the Unseen—
Æons and Emanations—intervene,
And from my shrinking soul the Unconditioned screen."
6,Emotion,HeroPoemsJackieRobinsonanAmericanHeroPoembyStanleyCooper,"He never asked to be a hero
For him, playing ball would be just fine
Potentially his chance was less than zero
To overcome that black-white racist line
Unlike Duke, Dimag and Mickey
Jackie entered through back doors
The stage was set by Mr. Rickey
For Robinson to fight that Civil War
Sports, they say, mirrors society
So, they should have hung their heads in shame
For what was then America's propriety
Brought prejudice to every game
The Brooklyn Bums, at long last, found salvation
When Robinson's talents were revealed
With the awesome double-play combination
Reese and Jackie brought to Ebbetts Field
Stealing fan's hearts with baseball fire
Displaying skills in every way
Robinson played with such desire
Stealing bases most every day
They could never expect fom him the expected
He turned the most racist hate to love
And finally he was most respected
Respect that came from more than bat and glove
For Jackie, baseball was more than just a game
He opened doors for Campy, Mays and others
Number 42, now in the Hall of Fame
Proved men of all colors could play in life as brothers
He never asked to be a hero!"
7,Emotion,HeroPoemsTheHeroPoembyBurnellRaphael,"Crossing the battlefield early today
Amidst bombs dropping, bullets flying,
I saw a soldier kneel to pray
Amongst the wounded and dying.
I could see a cross on his arm
As he knelt in the slimy mud,
He seemed not to show any alarm
Binding wounds, giving blood.
An enemy tank rumbled by
Crushing the wounded and the dead,
A soldier crying,""Am I going to die?
I'm badly wounded in my head.""
The medic crawled over to him
Looked, then bowed his head in prayer,
He watched as the lad's eyes grew dim
Then covered the body with loving care.
A shell exploded at his side
Shrapnel ripped into his chest,
On the field the medic died
Thinking, ""Lord, I did my best."""
8,Emotion,HeroPoemsAHeroPoembyKatharineTynan,"He was so foolish, the poor lad,
He made superior people smile
Who knew not of the wings he had
Budding and growing all the while;
Nor that the laurel wreath was made
Already for his curly head.
Silly and childish in his ways;
They said: 'His future comes to naught.'
His future! In the dreadful days
When in a toil his feet were caught
He hacked his way to glory bright
Before his day went down in night.
He fretted wiser folk--small blame!
Such futile, feeble brains were his.
Now we doff hats to hear his name,
Ask pardon where his spirit is,
Because we never guessed him for
A hero in the disguise he wore.
It matters little how we live
So long as we may greatly die.
Fashioned for great things, O forgive
Our dullness in the days gone by!
Now glory wraps you like a cloak
From us, and all such common folk."
9,Emotion,HeroPoemsHeroPoembysaramessina,"No one sits with him
he doesnt fit in
we feel like we do when we make fun of him
cause you want to belong
Do you go along
his pain is the price paid for you to belong
its not like you hate him or want him to die
but maybe he goes home and thinks suicide
or he comes back to school with a gun at his side
and a kindness from you might  have saved his life
Heros are made when you make a choice
you could be a hero
heros do whats right
you could be a hero
you might save a life
you could be a hero
you could join the fight
for whats rights, for what right, for whats right
no one talks to her she feels so alone
shes in to much pain to survive on her own
the hurt she cant handle overflows to a knive
she writes on her arm
wants to give up her life
each day she goes on is a day thats shes brave
fighting the lie that giving up is the way
each moment of courage
her own life she saves
when she throws the pills out
a hero is made
you could be a hero
heros do whats right
you could be a hero
you might save a life
you could be hero
you could join the fight
for whats right, for whats right, for whats right
no one talks to him about how he lives
he thinks that the choices he makes are just his
doesnt know hes a leader with hte way he behaves
and others will follow the choices hes made
he lives on the edge
hes old enough to decide
his brother who wants to be him is just nine
he can do what he wants
because its his right
the choices he makes change a nine year olds life
Heros are made when you make a choice"
10,Emotion,HeroPoemsWhatIsAHeroPoembyChrispinJohnson,"Never did I ever think of the definition of a hero.
Is a hero someone who defends the innocent who can’t defend themselves?
Does a hero need's to be arcane? Is a hero someone who thinks of others first?
Is a hero someone who faces dangers in times of peril despite all the odds? Is a hero someone who goes that little extra mile against all odds to make the world a better place?
Are heroes seen as heroes because they are intellectual, strong, fast, braves’ danger or because they are arcane? No, a hero is someone who is hopeful in times when seen as all hope is gone, although hope may be frail it’s hard to kill.
A hero is someone who fights all kind of injustice but also who is merciful. A hero is someone who is compassionate to others needs and difficulties, someone who is loyal to fighting injustice and sincere in what they are doing but with wisdom.
Show me a person with the attributes of being merciful, compassionate, loyal, sincere and wise and I will not only show you a hero but a Legend."
11,Emotion,HeroPoemsTheDeathOfAHeroPoembyFrancisDuggan,"From Meelin he came to Millstreet Town to die
For Ireland with a bullet in hie eye
And though more than eighty years since then have come and gone
The name of brave McCarthy still lives on.
He died in agony and painful pain,
His blood flowed down the flags of Millview Lane
If every Irishman were half so true
Then Ireland now would have the thirty two.
And though his only reward was the grave
McCarthy died for Ireland and died brave
He could have turned and ran away that night
But he stood and fought for what to him was right.
The Irish Republic is a part of Europe now
And our Ministers to Europe's big men bow
If he'd survived and stilll lived on today
'Twould be interesting what he'd have to say.
In Meelin stand a monument to the name
Of the man who brought upon that Village fame
To the noble hearted one of great renown
Who fought and died in famous Millstreet Town."
12,Emotion,HeroPoemsHeroPoembyRickyBaker,"A Hero is someone looked up to,
Who others could love to be,
A Hero is someone, who is very courageous,
And willing to put their life aside for another’s happiness or well being,
A Hero is anybody, anybody who can make someone’s day,
Or to help out with a simple chore,
A Hero does not have to be successful,
Or to complete their great intention,
A Hero does not have to be able to fly,
Nor to have any other superhuman power,
A Hero can be of any sex, race, or species,
They do not have to be human,
A Hero is not somebody, who is good at everything,
They don’t even have to be good at very well anything,
A Hero is somebody, who could only listen,
They could make you smile with out any words,
A Hero is someone, who could stand up for you,
Or to agree in your beliefs,
A Hero could be your Teacher,
helping you learn towards your future,
A Hero is anybody, and everybody,
Everyone is someone’s Hero,
And everybody has a Hero."
13,Emotion,HeroPoemsOurFallenHeroPoembyLagayaEvans,"Our Fallen Hero
Stands tall in our minds
As he lay lifeless
To save your child and mine
A good man he was
We'll hear everyone say
That doesn't even touch
The man he was that day
Many will say
I'd do the same
I'd lay down my life
If tragedy became
Yet, all we do know
Stood a great man
In our time of trouble
He took a stand
His rewards are great
So selfishly we can say
Our Fallen hero
Saved our children that day
11/16/05
In my son and daughters high school this past year a 14 yr. old boy shot 3 of our principals killing 1. He was a great man and still is in all our minds. My son just graduated this May 2006~ and they both were there to speak at his graduation. They came back to work in about 6 weeks after being shot. They both were critically injured and doctors didn't know if they would live. Our head principal was shot 3 times and still took the gunman down and subdued him and then got on the intercom and put the school in lock down. That's what kind of men they all 3 are. I'm proud that my kids have roll models like them in their lives."
14,Emotion,HeroPoemsNotAPrinceButAHeroNonethelessPoembysjgoldner,"i caught a frog and put him in a
fishbowl
and said,
'now you know how i feel.'
and he swam to the
bottom
and
drowned himself."
15,Emotion,HeroPoemsGeneralGrantTheHeroOfTheWarPoembyGeorgeMosesHorton,"Brave Grant, thou hero of the war,
Thou art the emblem of the morning star,
Transpiring from the East to banish fear,
Revolving o'er a servile Hemisphere,
At large thou hast sustained the chief command
And at whose order all must rise and stand,
To hold position in the field is thine,
To sink in darkness or to rise and shine.
Thou art the leader of the Fed'ral band,
To send them at thy pleasure through the land,
Whose martial soldiers never did recoil
Nor fail in any place to take the spoil,
Thus organized was all the army firm,
And led unwavering to their lawful term,
Never repulsed or made to shrink with fear,
Advancing in their cause so truly dear.
The love of Union burned in every heart,
Which led them true and faithful from the start,
Whether upon water or on land,
They all obeyed their marshall's strict command,
By him the regiments were all surveyed,
His trumpet voice was by the whole obeyed,
His order right was every line to form,
And all be well prepared to front the storm.
Ye Southern gentlemen must grant him praise,
Nor on the flag of Union fail to gaze;
Ye ladies of the South forego the prize,
Our chief commander here to recognize,
From him the stream of general orders flow,
And every chief on him some praise bestow,
The well-known victor of the mighty cause
Demands from every voice a loud applause.
What more has great Napoleon ever done,
Though many battles in his course he won?
What more has Alexander e'er achieved,
Who left depopulated cities grieved?
To him we dedicate the whole in song,
The verses from our pen to him belong,
To him the Union banners are unfurled,
The star of peace the standard of the world."
16,Emotion,HeroPoemsSorrowMakesOneAHeroTomorrowPoembyMailrangamVisvanathanVenkataraman,"Without sorrow life is zero
We must accept fate's arrow
If our efforts are thorough
Our sorrow, God will borrow
Sorrows nicely shape our mind
Sorrows stop our being blind
Via sorrows, remedies we find
Sorrows are indirectly kind
In the absence of sorrow
Our mind does not grow
We think not like a hero
Our attitude is made narrow
Sorrows must be overcome
For which efforts we welcome
At last strong we become
This is sorrows' outcome
Our will-power, sorrows increase
To our heart, sorrows supply grease
Our talents, only sorrows release
In a gist, sorrows supply peace
Every sorrow at last dies
Not because of our cries
But because our soul tries
Life and success, sorrow ties
Sorrow less person is none
Sorrow is sure, if life has begun
'Sorrow trains brains' is a slogan
Sorrow is a tamable dragon
In sorrow, all must dip
By coming under its grip
All are lashed by sorrow's whip
To every life, sorrow makes a trip
Now sorrow will somehow vanish
But you cannot fully relinquish
Further sorrows, time will furnish
From life, sorrow, none can banish
Life and sorrow are closely associated
By life, sorrow is very much fascinated
By sorrow, peace is initially confiscated
Sorrow grows when life is sophisticated."
17,Emotion,HeroPoemsThePoetAsHeroPoembySiegfriedSassoon,"You've heard me, scornful, harsh, and discontented,
Mocking and loathing War: you've asked me why
Of my old, silly sweetness I've repented--
My ecstasies changed to an ugly cry.
You are aware that once I sought the Grail,
Riding in armour bright, serene and strong;
And it was told that through my infant wail
There rose immortal semblances of song.
But now I've said good-bye to Galahad,
And am no more the knight of dreams and show:
For lust and senseless hatred make me glad,
And my killed friends are with me where I go.
Wound for red wound I burn to smite their wrongs;
And there is absolution in my songs."
18,Emotion,HeroPoemsOurHeroPoembyRobertWilliamService,"""Flowers, only flowers -- bring me dainty posies,
Blossoms for forgetfulness,"" that was all he said;
So we sacked our gardens, violets and roses,
Lilies white and bluebells laid we on his bed.
Soft his pale hands touched them, tenderly caressing;
Soft into his tired eyes came a little light;
Such a wistful love-look, gentle as a blessing;
There amid the flowers waited he the night.
""I would have you raise me; I can see the West then:
I would see the sun set once before I go.""
So he lay a-gazing, seemed to be at rest then,
Quiet as a spirit in the golden glow.
So he lay a-watching rosy castles crumbling,
Moats of blinding amber, bastions of flame,
Rugged rifts of opal, crimson turrets tumbling;
So he lay a-dreaming till the shadows came.
""Open wide the window; there's a lark a-singing;
There's a glad lark singing in the evening sky.
How it's wild with rapture, radiantly winging:
Oh it's good to hear that when one has to die.
I am horror-haunted from the hell they found me;
I am battle-broken, all I want is rest.
Ah! It's good to die so, blossoms all around me,
And a kind lark singing in the golden West.
""Flowers, song and sunshine, just one thing is wanting,
Just the happy laughter of a little child.""
So we brought our dearest, Doris all-enchanting;
Tenderly he kissed her; radiant he smiled.
""In the golden peace-time you will tell the story
How for you and yours, sweet, bitter deaths were ours. . . .
God bless little children!"" So he passed to glory,
So we left him sleeping, still amid the flow'rs."
19,Emotion,HeroPoemsTheHeroAndTheVillainPoembyNoelLopez,"When you see a Hero,
what do you think of the Hero?
'The Hero is Amazing'
'The Hero saves lives'
'The Hero is a bad person, not even human.'
'He stinks and I don't like the hero.'
People love the hero,
they love the hero cause he saves lives,
they love him cause he protects the city,
Some people don't like the hero cause they are
the ones who do crime.
Crimes like murder, kidnapping, stealing, sell drugs,
rob banks.....   but the person who hates the hero the
most.....  is the Villain.
The ones who hate the Villain the most is the people,
the hero never takes a life, the hero doesn't hate the Villain, the hero wants to help the Villain.
The Villain knows he needs help, but the Villain Doesn't want help, the Villain has been through an emotional life, the villains hates everyone...
Everyone knows a Superhero story goes, the Villain ends up Dead..
Everyone must know this..
Sometimes all the Villains were once heroes..
You die a hero, or you live long enough to see
yourself become the Villain...."
20,Emotion,HeroPoemsMyHeroPoembyNathanKraft,"My Hero is Many,
My Hero is One.
My Hero Proudly Holds a Gun.
My Hero Fights,
My Hero Kills,
My Hero Falls Out in the Field.
My Hero Laughs,
My Hero Cries,
My Hero Tries and Tries and Dies.
My Hero is Dirty,
My Hero is Smart,
My Hero Charges Towards the Front.
My Hero's a Soldier,
My Hero's a Marine,
My Hero's A Sailor Riding Across the Seas.
My Hero's an Airman,
My Hero Sacrifices,
My Hero Loves.
My Hero is Mine"
21,Emotion,HeroPoemsMyBestFriendIsAlsoMyHeroPoembybeautifulimperfection,"I just sat there
trying to hold in
all my emotions
I didn't want to give in.
But then you showed me
bottling up emotions doesn't always work
it only leaves you feeling
like a totally worthless dork.
So I gave in to you
and told you what was going on
and together we fought this thing
that was going terribly wrong.
You gave me the strength I needed
to just carry on
without you,
my happiness would be gone.
You were my shoulder to lean on
you knew just what to say
you knew when I needed a hug
or I just needed you to pray.
so I want to thank you
for always being there
even when I myself have forgotten
what it's like to care.
Thanks for putting up
with all the things I've put you through
you are truly the greatest friend
I have ever knew."
22,Emotion,HeroPoemsAHeroInTheOrdinaryWorldPoembyBrittanyGraviet,"A hero in the ordinary world,
Washes dishes in the sink
Adventure softly whispers
'The world dies without thee'
The dishes clatter
Chipping and cracking.
Paralyzed the hero stands.
This voice, all too familiar,
Echo's his deep yearning.
'Save the world, and be a change.
You watch the world like TV.
Not liking the show,
But too lazy to reach for the remote.'
Shaken, he falls to his knees
No confidence to fuel him.
Who is he to touch lives,
And improve the world?
Adventure screams,
'Rise to thy feet ye vagabond,
flourish your glory,
before i pass thee by again.'"
23,Emotion,HeroPoemsHeWasABigHeroPoembyFrancisDuggan,"He has just turned fifty his fastest pace slow
He is not the man he was twenty years ago
When they used to toast him at the local pub
And he was the hero of the football club
But time it did not wait for him time it ticked on
And he can only talk now of his better days gone
When he was his football club's number 1 player
And he could run as fast as a wildborn hare
And though he has such good memories of the past
The Seasons came and went and time went so fast
Whilst yet not an old man his hair is quite gray
And clearly he has known a far better day
Two decades ago when his hair was dark brown
He was a big hero the toast of the town."
24,Emotion,HeroPoemsSoldiersWhoWishToBeAHeroPoembyAnonymousAmericas,"Soldiers who wish to be a hero
Are practically zero.
But those who wish to be civilians,
Jesus, they run into millions."
25,Emotion,HeroPoemsAHeroPoembyJoshCarew,"A Hero is someone looked up to,
Who others could love to be,
A Hero is someone, who is very courageous,
And willing to put their life aside for another’s happiness or well being,
A Hero is anybody, anybody who can make someone’s day,
Or to help out with a simple chore,
A Hero does not have to be successful,
Or to complete their great intention,
A Hero does not have to be able to fly,
Nor to have any other superhuman power,
A Hero can be of any sex, race, or species,
They do not have to be human,
A Hero is not somebody, who is good at everything,
They don’t even have to be good at very well anything,
A Hero is somebody, who could only listen,
They could make you smile with out any words,
A Hero is someone, who could stand up for you,
Or to agree in your beliefs,
A Hero could be your Teacher,
helping you learn towards your future,
A Hero is anybody, and everybody,
Everyone is someone’s Hero,
And everybody has a Hero.
02/28/2008"
