,topic,file,text
582,Emotion,FaithPoems0190ANovelFairyStoryForAPoeticMultiFaithGiftmasPoembyMichaelShepherd,"‘Cinderella’ (I’m using this pseudonym
to protect her identity, now she’s
ex-hot, ex-famous) , while sweeping, dusting,
fire-lighting, all that deprived childhood stuff -
felt that she had more to offer;
had not realised her full potential; so
in a cheap exercise book, wrote her
fictionalised life-story, suitably worked up,
in her spare moments; even, when short of incident,
setting up some neat situation with
her ugly sisters etc.
thanks to her friend Buttons who
was computer-literate, hence
his name, ha, she
self-published and, with a wand-wave from
her Fairy Godmother
by ‘sheer chance’ when her sisters had a famous critic
and, unusually, discoverer of talent, to dine,
hit the headlines – Booker Prize
in an off-year, interviews, weary book tours of the US,
life-style articles, all that,
- a gift to journalists, rags to riches story –
was courted through many photo-opportunities
by ex-hot celebs in search of  boosting their
waning reflected glory… in short,
Hit It Big.
‘We always knew
her talent’ wrote her botoxed sisters…
until one day, her Fairy Godmother
winging past late as usual and slightly
tetchy with it, reckoned that
Our Heroine had had her fifteen minutes
and wondered what to do to slap her down; until
she remembered that she’d fixed that too –
Famous First Book Novelists
have to spend the following year
while the rest of us are having fun out there,
seeing their name fade from the headlines
and the gossip columns and
the stories planted by their PR
and cutting down on the parties
and those they do go to, they
are only half-there as they watch
for 'material', as a break from
sitting at their desk while confidence
dwindles into self-doubt
and the critics sharpen up their talons, as Last Year's Winners
scrape out that Second Novel..
and the Fairy Godmother (who
doubles as the Wicked Witch, it’s
a divine joke)    chuckled in a somewhat
double-edged way, whilst checking
the time and remembering that for fairies,
arriving late increases the dramatic tension.
there’s a moral here for poets too but
to point it out would be
uncool"
583,Emotion,FaithPoemsDoubtFearAndFaithPoembyDavidTaylor,"I doubt you will read this
I don’t believe this is of any use
I can’t concede this is a worthy verse
I don’t think I could do any worse
I never will be right
When I just can’t see any light
When I am so unclear
When I am far from your love
When I am gripped by fear
I never will be true
If I do not have faith in You."
584,Emotion,FaithPoemsGermanFaithPoembyFriedrichSchiller,"Once for the sceptre of Germany, fought with Bavarian Louis
Frederick, of Hapsburg descent, both being called to the throne.
But the envious fortune of war delivered the Austrian
Into the hands of the foe, who overcame him in fight.
With the throne he purchased his freedom, pledging his honor
For the victor to draw 'gainst his own people his sword;
But what he vowed when in chains, when free he could not accomplish,
So, of his own free accord, put on his fetters again.
Deeply moved, his foe embraced him,--and from thenceforward
As a friend with a friend, pledged they the cup at the feast;
Arm-in-arm, the princes on one couch slumbered together.
While a still bloodier hate severed the nations apart.
'Gainst the army of Frederick Louis now went, and behind him
Left the foe he had fought, over Bavaria to watch.
""Ay, it is true!  'Tis really true!  I have it in writing!""
Thus did the Pontifex cry, when he first heard of the news."
585,Emotion,FaithPoemsFaithMathenyPoembyEdgarLeeMasters,"At first you will know not what they mean,
And you may never know,
And we may never tell you: --
These sudden flashes in your soul,
Like lambent lightning on snowy clouds
At midnight when the moon is full.
They come in solitude, or perhaps
You sit with your friend, and all at once
A silence falls on speech, and his eyes
Without a flicker glow at you: --
You two have seen the secret together,
He sees it in you, and you in him.
And there you sit thrilling lest the Mystery
Stand before you and strike you dead
With a splendor like the sun's.
Be brave, all souls who have such visions!
As your body's alive as mine is dead,
You're catching a little whiff of the ether
Reserved for God Himself."
586,Emotion,FaithPoemsTheTendrilsFaithPoembyEllaWheelerWilcox,"Under the snow in the dark and the cold,
A pale little sprout was humming;
Sweetly it sang, ‘neath the frozen mold,
Of the beautiful days that were coming.
“How foolish your songs, ” said a lump of clay,
“What is there, I ask, to prove them?
Just look at the walls between you and the day,
Now, have you the strength to move them? ”
But under the ice and under the snow
The pale little sprout kept singing,
“I cannot tell how, but I know, I know,
I know what the days are bringing.”
“Birds, and blossoms, and buzzing bees,
Blue, blue skies above me,
Bloom on the meadows and buds on the trees,
And the great glad sun to love me.”
A pebble spoke next: “You are quite absurd.”
It said, “with your song’s insistence;
For I never saw a tree or a bird,
So of course there are none in existence.”
“But I know, I know, ” the tendril cried,
In beautiful sweet unreason;
Till lo! from its prison, glorified,
It burst in the glad spring season."
587,Emotion,FaithPoemsModernLoveXxxiiFullFaithIHavePoembyGeorgeMeredith,"Full faith I have she holds that rarest gift
To beauty, Common Sense. To see her lie
With her fair visage an inverted sky
Bloom-covered, while the underlids uplift,
Would almost wreck the faith; but when her mouth
(Can it kiss sweetly? sweetly!) would address
The inner me that thirsts for her no less,
And has so long been languishing in drouth,
I feel that I am matched; that I am man!
One restless corner of my heart or head,
That holds a dying something never dead,
Still frets, though Nature giveth all she can.
It means, that woman is not, I opine,
Her sex's antidote. Who seeks the asp
For serpent's bites? 'Twould calm me could I clasp
Shrieking Bacchantes with their souls of wine!"
588,Emotion,FaithPoemsShesLosingHerFaithPoembyKateWarner,"She lies alone upon her bed
With a million thoughts
Running through her head
She blames herself for everything
Its all her fault, even though
She knows deep down inside
Beneath all the tears and the lies
That its not her fault
You cant imagine all the pain
She feels, and you cant imagine
All the days she fears
'please give me a chance'
I hear her pray, 'please let me
Have a better day, let me hold
My head up high, instead of hiding
Every day and night'
She gets up and looks in the mirror
Who is this girl
Staring back at her?
She doesn’t know who she is anymore
All that she wants is an open door
To lead her to the light
She doesn’t want to argue no more
And she doesn’t want to fight
She walks back to her bed of dreams
Its like she's on a tightrope
Ready to fall at any time
She looks up at the sky
Wishing that she could fly
Because anywhere is better than here
Better than all this fear
Then she looks over to her door as it opens
She's losing her faith…"
589,Emotion,FaithPoemsSonnetFaithPoembyDrACelestineRajManoharMD,"A man with faith can win the world with ease;
A war is won with faith in its soldiers;
A leader with faith brings about world’s peace;
A faithless man always has unknown fears.
Strong faith can heal an adamant disease;
Faith in oneself makes one self-confident;
Faith in religion and God gives mind’s peace;
Faith alters in our favor, an event.
Faith is needed to maintain good friendship;
You ought to have faith in a stranger too;
Faith in the captain brings to harbor ship;
Faith is needed even to win a coup!
Have faith in the man for earthly things done;
Have faith in God for Heavenly grace won."
590,Emotion,FaithPoemsWeCallItFaithPoembyPdishere,"The dust settles and past has been locked
Roads are empty where you once walked
The veiled songs of when you were young
Never seem to be back on your tongue.
Something’s changed, yet somehow it is the same
Stuck in a rut of time, yet the clocks’ hands tick away
Too afraid to let the past spill on the canvas of today? -
Just look up at the sky
And he will show you the way.
Images unpleasant, your conscience will decay
You’ve saved the hurt for a rainy day
Changing the photo on the photo frame
Your misplaced life you’re trying to reclaim.
The rain is lashing down hard, yet the sun is bright
The past re-plays before your eyes
The script is re-written and you’ve come clean
Metamorphosed routine-a role has been essayed
He has shown you the way.
(5th December 2006)"
591,Emotion,FaithPoemsWithFaithAndHopePoembyErnestineNorthover,"The tears fall, but no one's there to heed them,
The heart it mourns, but no one sees the hurt.
An emptiness has seeped into the brainstem,
One's feeling dazed, and no longer alert.
Such desolation haunts one's whole persona,
What can one do, and just where can one go,
You feel as if you've now become a loner,
How droplets, when they're prompted, freely flow.
To cry can be a painful kind of action,
One weeps for someone one has loved so well,
Yet grieving gives release, if just a fraction,
Which heals the ache and lets sadness dispel.
Only time will ease such utter sorrow,
That comes from losing someone Oh, so dear,
But with the dawning of each new tomorrow,
With faith and hope you'll find a panacea.
©   Ernestine Northover"
592,Emotion,FaithPoemsHaveALittleFaithInMePoembyMissyLynn,"When the road gets dark
And you can no longer see
Just let my love throw a spark
And have a little faith in me
And when the tears you cry
Are all you can believe
Just give these loving arms a try
And have a little faith in me
And
Chorus:
Have a little faith in me
Have a little faith in me
Have a little faith in me
Have a little faith in me
When your secret heart
Cannot speak so easily
Come here darlin’
From a whisper start
To have a little faith in me
And when your back’s against the wall
Just turn around and you will see
I will catch, I will catch your fall baby
Just have a little faith in me
***This is a song thats one of my favorits of all time i heard it on the movie 'Benny and Joon' and have loved it ever since.***"
593,Emotion,FaithPoemsKeepTheFaithPoembyMaryNagy,"A mother's job is to shelter.
A mother's job is to care.
It's my pleasure to do these things for you,
and enjoy the life we share.
Problems may surround us
and try to keep us down.
But, I will never give up the faith
on the love that we have found.
Our family is precious.
To me, there is no end.
Not only are you my children,
You also are my friends.
I know you will be happy.
I know you'll set your mind
to go after the success in life
only a good person can find.
Don't let them tell you different.
Don't let them break your stride.
Don't let their hatred hurt you.
Remember...you have pride."
594,Emotion,FaithPoemsARoadNamedFaithPoembyDavidTaylor,"Incandescent moonlit evening light
A walk along a distant road
That leads where no one has described
Some have been there and tell me so
But in going they cannot say
What they saw when they went that way.
Incandescent moonlit evening light
A walk that’s leaving bright lights of
All that’s known behind
And not knowing what will be found
Walking alone not in a crowd
Along a distant road as if in a shroud.
Incandescent moonlit evening light
I know not what is out of sight
They say that once this road is travelled right
With no more journeys will I be troubled
Freely marching as to death
But only death of all that has been left.
Incandescent moonlit evening light
Will I arrive this very night
Will I surrender all I own
Am I ready, can I atone
With all this universe and most of all
With all my actions since my first birth?
Incandescent moonlit evening light
They call me back
Thoughts binding tight
I walk on simply letting go
If I arrive
Who will ever know?"
595,Emotion,FaithPoemsFaithPoembyJonAlan,"When She returns to the woods,
Or the dream that is Her creator
It is the late afternoon.
Her exit beckons the coming dusk
And leaves me with a most excrutiating tremor
In the depth of my being
That She could somehow know me
Yet not be able to sit and chat
Yet I know Her, and that will have to suffice,
Until I solve this permanent mystery.
She comes as a breeze each day around noon,
The highest leaves of the trees bristle
With a shiver of anticipation,
In the heat of these special moments
She raises Her voice, as a sustained wind bends
The branches holding the leaves,
I marvel that those branches
Willingly bending with Her breath,
Never breaking.
From this wind comes the slight force of Her questions
Carried for how many miles
By the voice of Her unending curiosity,
I fancy Her soft pondering to be evidence
Of Her sensuous presence.
Her questions are never blunt or overbearing
So that even all evil defers to Her ease.
We sit together each late afternoon
As I rekindle my love of Her voice
Its sweetest rhythm, Its sensitive knowing
And I revel in my own reflection,
Thanks to a breeze with a voice
That is, to me, a person
Yet to others I must surely seem insane with each coming season.
Her exit beckons the coming dusk
And leaves me with a most excrutiating tremor
In the depth of my being
That She could somehow know me
Yet not be able to sit and chat,
Yet I know Her, and that will have to suffice.
Then She returns to the woods,
Or the dream that is Her creator,
As the dusk descends softly
She blows me a kiss."
596,Emotion,FaithPoemsIfThisWereFaithPoembyRobertLouisStevenson,"God, if this were enough,
That I see things bare to the buff
And up to the buttocks in mire;
That I ask nor hope nor hire,
Nut in the husk,
Nor dawn beyond the dusk,
Nor life beyond death:
God, if this were faith!
Having felt thy wind in my face
Spit sorrow and disgrace,
Having seen thine evil doom
In Golgotha and Khartoum,
And the brutes, the work of thine hands,
Fill with injustice lands
And stain with blood the sea:
If still in my veins the glee
Of the black night and the sun
And the lost battle, run:
If, an adept,
The iniquitous lists I still accept
With joy, and joy to endure and be withstood,
And still to battle and perish for a dream of good:
God, if that were enough!
If to feel, in the ink of the slough,
And the sink of the mire,
Veins of glory and fire
Run through and transpierce and transpire,
And a secret purpose of glory in every part,
And the answering glory of battle fill my heart;
To thrill with the joy of girded men
To go on for ever and fail and go on again,
And be mauled to the earth and arise,
And contend for the shade of a word and a thing
not seen with the eyes:
With the half of a broken hope for a pillow at night
That somehow the right is the right
And the smooth shall bloom from the rough:
Lord, if that were enough!"
597,Emotion,FaithPoemsFaithPoembyIndiraRenganathan,"Faith's no legs
So can not walk
Nor has any wings
So can not fly
Immature and tiny
Incubate in heart
Safe-guard to safe-guard
Rooted deep in allegiance
To break open light
In vision, listen, speech
In every disability
Of even on infernal-couch
For faith's now grown with wings
'Hope and confidence'"
598,Emotion,AngelPoemsAngelPoembytakeywilliams,"It’s been five months since you went away
Left without a word and nothing to say
When I was the one who gave you my heart and soul
But it wasn’t good enough for you, no
So I asked god
God send me an angel
From the heavens above
Send me an angel to heal my broken heart
From being in love
’cause all I do is cry
God send me an angel
To wipe the tears from my eyes
And I know it might sound crazy
But after all that I still love you
You wanna come back in my life
But now there is something I have to do
I have to tell the one that I once adored
That they can’t have my love no more
Cause my heart can’t take no more lies
And my eyes are all out of cries
God send me an angel
From the heavens above
Send me an angel to heal my broken heart
From being in love
’cause all I do is cry
God send me an angel
To wipe the tears from my eyes
Now you had me on my knees
Begging God please to send you back to me
I couldn’t eat, I couldn’t sleep
You made me feel like I could not breathe
Now all I wanted to do was to feel your touch
And give you all my love
But you took my love for granted
Want my lovin’ now
But you can’t have it
God
God send me an angel
From the heavens above
Send me an angel to heal my broken heart
From being in love
’cause all I do is cry
God send me an angel
To wipe the tears from my eyes
Oh god, send me (God send me an angel)
An angel (wipe the tears from my eyes)  oh baby
Send me an angel from the heavens above
Send me an angel (God send me an angel)
From being in love (send me an angel)
Oh god, send me an angel
Send me an angel (send me an angel)
Ooohhhh.."
599,Emotion,AngelPoemsEarthboundAngel5SensuousAngelOrTheRoseOfSharonPoembygordoncoombes,"Being an earthbound angel
her wings curled up
enclosing her/cloaking her
parted letting him in
watching herself from afar
each time desiring/regretting the parting
lost in sensuous pleasures
feeding baser appetites
in the garden of earthly delights
in search of an unbounded love
seeking an Adonis
a satyr/a faun
who satisfies her desires
unable to see beyond the masks
willingly seduced
after a few drinks
the short lived affair
lasting a night or a weekend
left feeling confused
only to begin her search again -
From out of her eyes I see
a light shimmering
round about her body
shimmers
as she dips her wings in mud
the light fades
the burden too great
she goes on to fulfill her fate
trapped in an unending cycle
believing she can expect no more
of life than this
shapes her life to come
of an unending line of lovers
in the end all the same
all interchangeable -
Awakened from my apathetic cynical slumber
her angelic singing soothes
me for a moment /gives me hope
as her wings unfold
I desire to be enfolded
by the golden haired angel
her eyes innocent & forgiving
her face full of light
to be enfolded in her wings
of shimmering pure light
to soar above this city
bathed in her cool bluesy voice
before she becomes earthbound again -"
600,Emotion,AngelPoemsFallFromGraceAngelNoMoresongPoembyEboneIngram,"Verse 1:
Life is like a broken dream
And I can't even feel you out there anymore
(No I can't, and it kills me)
Baby, yes I'm still your angel
But my wings fell out so long ago
And now flying o'er horizon's just a wistful stare
My Nirvana's shot to Hell
And I do not think that there
Will ever be a sanctuary here
A demon rages in my soul
My body longs for desecration
Though I know there's no light beyond the tunnel there
And Twilight calls to me
Bids me sleep endlessly
The halo from my hair
Falls to the floor.
Verse 2:
If you see my broken heart
Could you tell it where I am and where I'm gonna be
(It I've lost, and I'd like it back)
I'm consumed by flames of darkness
And my mind is cursed with fantasies
That I know will never be more than forgotten dreams
My Nirvana's shot to Hell
And I know for sure that there
Will never be a sanctuary here (in me)
That demon rages in my soul
A beast that I  still yearn to vanquish
But I've no strength to lift my hand and crush it there
The darkness calls to me
And now I cannot sleep
I'm begging baby save
Me from myself
(repeat section, humming first 6 bars and singing last 4)
And sunlight blinds my eyes
Catches me by surprise
I know I'll never see
That dawn again"
601,Emotion,AngelPoemsYouAreAnAngelPoembyCorreinaMacRae,"(Dedicated to my Grandmother whom past away MAR.2003)
You are an Angel
Strong and smart
loving and sweet,
you are one of the
greatest people I ever
got to meet.
I’ll never forget you
your in my heart
and even though your
not with me
we’re not far apart.
You are an Angel
in everyone’s eyes
gentle and caring
for the good, you changed
everyone’s lives
You are an Angel
with a big heart and
a gentle smile.
When you’d do something
for someone you always went
that extra mile.
You are an Angel
always there to lend
a helping hand
you were always so loving
and would always understand
You are an Angel
strong and smart
loving and sweet
you are one of the greatest
people I ever
got to meet."
602,Emotion,AngelPoemsFallenAngelPoembyJenniferRondeau,"I have fallen from sky,
Fallen to the ground,
I am the angel of sadness,
Angel of lost hopes,
Angel of lost dreams,
I am the fallen angel,
Fear me not,
I am here for reason,
That reason is to have a second chance in life,
That life I was given for a reason,
They took my wings,
They took me apart made me human,
I was the fallen angel,
But that fallen angel had one chance in life that she was given,
This angel won’t make the same mistakes she made before,
This angel will go down the right path that has been chosen for her,
This fallen angel know what she has to do to be forgiven."
603,Emotion,AngelPoemsanalgesicAngelParallelAngelPoembyDanielRichards,"I love to be free, among the clouds
And dancing,
It is here, where I meet with you,
Among the clouds romancing.
Unbinding are my hands,
As you set me free
You set my soul on fire
Enchanted, I climb high and higher
The pill, the coating
My angel, my plaything
Lighting flashes through the rain,
You come walking clearing the way
You move around me filling my chest, invoking emotions
An Aphrodite teasing priestess, and here in the heat of the night
And the light of the day, you remove everything
That ever stood in my way
The crash of confusion and the weight of dismay
Is halted, lifted and taken away
Replaced with enchantment and lyrical gift
Smoothing over the cracks of inner personal rift
The aches the pains, there all pulled away
By horse drawn chariots, made of gold clay
Enlightenment falls upon me, from emotional release
In this realm where I lay with ease,  surrounded by passionate love and harmonious peace
Your invoked emotions become entrancing
My analgesic angel, my psychedelic plaything
I take your hand, and you entwine with mine
The air falls silently still, seduction of my mind and will
I fall into you, you become one with me
You are my paradise shore, I’m you amorous sea
Frolicking in the surf with whispers of love,
Transfiguration of its purity into the whitest of doves
With exquisite form a launch from surf to sky
And now air born once more we fly, into tranquillity
Through the all Seeing Eye, a thunderous crash entering
The kaleidoscope sky, toward our final nirvana and our ultimate heights
As we now start the end of our heaven spent time in
The world, the realms and the clouds of the sky, the
Imprinted memories dress the sky as stars, and find the glowing
Sparkling spectacle further more enchants my mind
A roar thunder and a bolt of light the advancing
Waves of clouds unite, approaching faster then
A ferocious tide, time is almost up, on my
Analgesic angel and on the only world I dearly love
The air begins to whisper, a reduction of my mind and will
You hand slips go as you leave and untwines itself from me
My analgesic angel my psychedelic plaything
You revoke the emotions that are still entrancing
No more at ease, at a loss without the passionate love and harmonious peace
The enlightenment lifts from me, from emotional retreat
The horse drawn chariots made of gold clay
Pulling the return of the aches and the pains
Fracture again the surface of inner personal rift
Retracted and chained is the enchantment and lyrical gift
The crash of confusion and the weight of dismay
Is returning heavy and heading my way
Without the heat of the night and the light of the day
Everything that returns will remain in my way
Revoked emotions now fleeing my chest, from a retreating
Aphrodite teasing priestess
The pill, the coating
My angel, my plaything
Lighting flashes bringing the rain,
You go leaving and obscuring the way
Binding are my hands,
As without you I’m not free
Extinguish my burning soul
Disenchanted, I fall, fall and fall
I love to be free, among the clouds
And dancing,
And I will return in time, as this
World of realms and rhymes
Resides discreetly, somewhere in my mind"
604,Emotion,AngelPoemsDarkAngelFaithsAngelPoembyToughAngelflypurplebutterflyfly,"i was lost and alone, as I always am,
no one's around me nor understands
no one seems to care
I am waiting til it comes
they say its okay
and love me in some way
But just when I trust to love,
they forget what they say
i held the knife so close
as tears fall mixed with blood with purpose
began to fall slowly and lose
like a crazy crying  dead rose
i put the knife away and tried to wipe the blood,
that ran faster than I can describe.
an angel tapped my back
i saw him with wide open heart
thank you angel, my dear angel love
you took me out of the dark
and bring back my soul
you are angel, you are my all
- i love u my dark angel -"
