,topic,file,text
320,Emotion,BelievePoemsBelieveInMePoembyShellyPrice,"What have I done this time,
to deserve your wrath?
What infraction have I violated,
causing this kink in our path?
Where did I go wrong,
I really have to know.
Please tell me what I did,
don't just get up and go.
Don't shut me out again,
don't close every door.
Don't use silence as a weapon,
to justify settling a score.
Please talk to me, I'll listen,
to every word you have to say.
I'm your lover and your friend,
so please don't treat me this way.
Please tell me with words,
what has made you retreat,
into the darkness of solitude,
feeling defeated and beat.
It can't be what you think,
that would mean I had purpose.
Dig deeper for your answers,
don't just scratch on the surface.
Give me the benefit of your doubt,
and choose to trust and believe.
It takes far less energy to love,
than it does to practice to deceive.
2004"
321,Emotion,BelievePoemsIBelieveItNowPoembyJesselJaneTevarToring,"I never believed in magic...
until u came into my life;
then all have been magical in my eyes.
I never believed that dreams come true;
till u made them real for me..
then all I see with you is just reality.
I never believed that love could move mountains...
till u moved one for me;
and then i knew that love could set me free.
And i never believed that one could die of a broken heart.
I believe it now- when you left me...
when you left me helplessly.
: -("
322,Emotion,BelievePoemsIBelieveInYouPoembyNamieElisha,"I believe in your rising and falling
I believe in your smiles and tears
i believe  in your joys and pains
i believe in your seed  and name
i believe in your sunrise and sunset
i believe in your clouds and raindrops
i believe in your moon and galaxy of stars
i believe  in you struggles and hopes
i believe in your desires and angels
i believe in your soil
i believe  in your future
i believe in your generation
'cos i believe in you"
323,Emotion,BelievePoemsLittleWorldOfMakeBelievePoembyDavidHarris,"Sometimes I live in
my own little world of make believe.
Where the character in my stories
do the things, I wish I could.
They live out my fantasies some good some bad.
I am every character come what may.
They take me away from the real world that we live in.
Into the land of my dreams
into my own little world of make believe.
28 May 2008"
324,Emotion,BelievePoemsheartBelieveMePoembyJesselJaneTevarToring,"Heart, believe me.
That was just a night...
How fool it is for my mind
to linger his words this way;
to trace every curve of his lips
and to flip a shadow of his pretty hair.
Oh, how fool it is for my mind
to think of him this way.
Heart, believe me.
That was just a night;
and I became a fool forever."
325,Emotion,BelievePoemsIBelieveInAmericaPoembyTradeMartin,"I Believe In America…., we’re a nation of hopes and dreams…..,
Sweet freedom will fill our needs…., I Believe In America.
I Believe In America…., I believe we must fight for peace….,
My faith in us will never cease…., I Believe In America.
With His strength from up above…,
We’ll prevail on our massive quest…,
Our nation breathes kindness and love…..,
We’ll lead our world to happiness.
I Believe In America…, we are united in democracy….,
Defeating evil and hypocrisy…., I Believe In America.
Our Lord is watching every move we make…..,
I know He’ll help us do our best….,
Guiding us with every step we take….,
Because our lives are truly blessed.
I Believe In America…., we’re a nation of hopes and dreams…..,
Sweet freedom will fill our needs…., I Believe In America.
Yes, I Believe In America."
326,Emotion,BelievePoemsBelieveInAngelsPoembyTomaszJakubiak,"Believe in Angels
even if their wings are black
believe in the Devil
even if over his horns
you see a burning halo
Believe in Love that’s blind
and equally blind Hatred
Believe in words sneered by time
believe in Fear
Believe with your eyes and longing palms
pictures filled with colours and magical
Silence
Believe in touch, in music and in voice,
And in Quietness
Believe in thousands of everyday matters
One day just believe
In me"
327,Emotion,BelievePoemsAReasonToBelievePoembyDavidHarris,"Everyone needs a reason to believe.
To believe in God,
their family and friends,
their wife and their life.
Without having a reason,
life could never carry on,
but having a reason to believe
means anything you want,
you can go out and achieve.
(7 October 2007)"
328,Emotion,BelievePoemsBelieveMeIfAllThoseEndearingYoungCharmsPoembyThomasMoore,"Believe me, if all those endearing young charms,
Which I gaze on so fondly to-day,
Were to change by to-morrow, and fleet in my arms,
Live fairy-gifts fading away,
Thou wouldst still be adored, as this moment thou art,
Let thy loveliness fade as it will,
And around the dear ruin each wish of my heart
Would entwine itself verdantly still.
It is not while beauty and youth are thine own,
And thy cheeks unprofaned by a tear,
That the fervor and faith of a soul may be known,
To which time will but make thee more dear!
No, the heart that has truly loved never forgets,
But as truly loves on to the close,
As the sunflower turns on her god when he sets
The same look which she turned when he rose!"
329,Emotion,BelievePoemsWhyDontYouBelieveMeWhenISayYoureAmazingPoembyDanBrown,"Why don’t you believe me when I say you’re amazing?
When I say you have the most handsome face?
Why don’t believe me when I tell you I dream of it?
When I say its your lines, with my finger, I trace?
Why don’t you believe me when I say you’re amazing?
When I say your smile lights up my day?
Why don’t you believe me when I tell you its sexy?
When I tell you how you smile my troubles away?
Why don’t you believe me when I say you’re amazing?
When I say you have the goldenest hair?
Why don’t you believe me when I tell you it warms me?
When I say how I sit and stare?
Why don’t you believe me when I say you’re amazing?
When I say you have the softest skin?
Why don’t you believe me when I try to describe it?
When I don’t even know where to begin?
Why don’t you believe me when I say you’re amazing?
When I genuinely tell you I love you?
Why don’t you believe me when I tell you I need you?
When I say this is all so new?
Why don’t you believe me when I say you’re amazing?
Why do you suggest I lie?
I hope you’ll soon believe me when I say you’re amazing,
because I’ll say it till the day I die."
330,Emotion,BelievePoemsMakeBelieveWorldPoembyMargaretAlice,"She is Beyond
Good and Evil now
living in a world
of fantasy
where she cannot see
what reality
is telling her
In her make-believe world
there are only
her fundamentalist church
her literal Biblical belief
and her saintly self
figting in victory
against everybody else
because they refuse
to give up
the demons
only she
can see"
331,Emotion,BelievePoemsICanTBelieveItsBackAgianPoembyKaylaCorinneBeneteau,"i hold this piture in my time of sorrow,
death is walking aamounst my heart,
ripping,
taring,
till my life falls apart,
remorts of shame,
scar through pain,
the little emo girl to take the blame,
love is to death,
leaveing this life is the only thing i have left,
she dug a hole in my paper heart,
cutting hopes and dream,
ripping them apart,
how much more of this can i take,
till i fall down on the floor and break,
i remeber the very first time,
inside my mind,
i felt comforted like i had a sence of meaning,
love and hate,
deeath in debait,
holding my razor,
till the sorrow shall left,
i cant believe its back again from the place i had left,
remembering death,
my dreams are night marees,
slowly killing some,
for this i write to you,
my mom"
332,Emotion,BelievePoemsOnlyBelievePoembyGeorgeSavige,"Only believe
That Jesus can save.
Only believe
The Promise he gave.
A home in heaven
Is waiting for you.
A home in heaven,
Believe, it is true.
Jesus has died
To save you from sin.
Jesus has died
That you may come in.
Believing in Christ
You'll help spread the news.
Believing in Christ
You'll change peoples views.
Believing you'll work
To save some each day.
Believing you'll work,
And meet Him one day.
Give thanks to Him
For all that He's done.
Give thanks To Him
In prayer everyone."
333,Emotion,BelievePoemsFactsYouShouldBelievePoembyFrancisDuggan,"A gray haired scraggly looking fellow is all you can see
But I am not what you think I am when looking at me
You cannot look into the thoughts of my mind
Like you I too have a soul and I too can be kind.
A young person in life you have some way to go
And little of others you hardly would know
You seem to dismiss me as a crabbedy old man
But I too can be judgemental believe me I can.
I'm too old for playing mind games those days with me long gone
I feel happy enough just to be living on
Just one more mere mortal who was born to die
None do live forever the facts never lie.
The stuff that I write I cannot hope to sell
I'm just one more ageing poetaster who pens doggerel
I am not what you think I am for looks can deceive
And that too is a fact and facts you should believe."
334,Emotion,BelievePoemsICanTBelieveThemPoembyScarlet,"did they really think they could just take it all away
with just one word
did they think I would not fight
do they really think I gave a shit what they thought?
can they really be that stupid
do they really want me to be unhappy for the rest of my life?
cause that is what would happen if I listen to them
I can't believe it
I’ve suffered for 4 years
I now found happiness
do they think I wouldn't fight to keep it
how could they think that?
are they really that blind
do they not see I’m happier than I’ve ever been
truth is I’ve never been happy
until now
and I don't want to lose it
especial because they don't like the way I found it
can't they just be happy?
can't they just let me be happy?
apparently not
some family
they don't want me happy
they fucking want me trapped
trapped in the darkness
trapped with them
trapped is a state of numbness"
335,Emotion,BelievePoemsIBelieveIAmNIBelieveICanPoembyShakimaKelly,"I believe i am wise enuff 2 amke my own choices
i believe i can speak my mind n nt listen 2 other voices
i believe i am nice enuff 2 forgive n forget
i believe can do thins i wont regret
i believe i am better person that i was las year
i believe i can face all my fears
i believe i am a lot neater cents i ben n AVID
i believe i can break all my bad habbits
i believe i am better that i intended to be
i believe i can do all things through Christ wit Strength in me.(PHILLIPANS 4: 13)"
336,Emotion,BelievePoemsBelieveMeLoveYouPoembyhazemaljaber,"do you believe that,
you became every thing in my life..
do you believe that,
i care about you and missed you every moment..
do you believe that,
i need and want to be near to you every night..
do you believe that,
i love every one who is like you in face and a voice and a smile...
do you believe that,
i suffer so much in your leaving and never to take a breathe well...
do you believe that,
i afraid from my eyes to show up me that i love you...
do you believe that,
i become jealous from any air goes around your neck...
do you believe that,
i loved you and never loved one as you..
believe me that,
i love you..."
337,Emotion,BelievePoemsIBelievePoembyTiaMaria,"All night all day I have been thinking this way
Then I hear my thoughts in your lyrics today
Faith we have when two hearts can perceive
In love like this, how can we not believe"
338,Emotion,BelievePoemsBelievePoembyWanderingScarlet,"if you think
then you will be
you are what you believe
so believe what you want
and what you want will come true
just believe
just think
make your own fate
forge your own path
carve your own destiny
dont be held back by barriers
your small dreams are your barriers
your doubts are your barriers
dont be held back
anything is possible..."
339,Emotion,BelievePoemsIBelievePoembySiennaHarlequinn,"I believe that the sun shines after the rain
I believe if you don't get hurt you'll never gain
I believe in not doing things the easy way
I believe that being selfish doesn’t pay
I believe in a second chance
I believe in a life long romance
I believe there is life after death
And standing up to a life of mess
I believe in love at first sight
I believe that revenge isn’t right
I believe that first impressions last
And there is nothing better then a good laugh
I believe that dreams do come true
I believe there's destiny for me and you
I believe that good things come to those who wait
I believe love never arrives too late
I believe something good comes from something bad
I believe that for tears of happiness there are tears of sad
I believe everyone has a guardian angel
And the good you do will be rewarded well
I believe sometimes there is no explanation
I believe money can't buy people's affection
I believe you don't know what you've got until it's gone
I believe a new day arrives with every dawn
I believe a smile can be contagious
I believe in being very outrageous
I believe in living with no regrets
I believe that life is as good as it gets
I believe that God watches over us
I believe the little things are worth the fuss
I believe you have each friend for a reason
I believe you will get punished for treason
I believe that what comes first is family
I believe we should all live in harmony
I believe in making the most of a beautiful day
And it's not the end until everything's okay
I believe absence makes the heart grow fonder
I believe you will lose if you sit and wonder
I believe every experience teaches you a lesson
And nothing cures better then a drinking session
I believe everyone has one true love
I believe sometimes we need a little shove
I believe the whole world is a stage
I believe we only get better with age
I believe that to learn you have to live
I believe that to love someone you have to give
I believe one moment can change your life
And there's still help when you’re in strife
I believe everyone has one true friend
I believe love helps a broken heart mend
I believe in the power of a song
And things will change before too long
I believe living is the best experience
I believe in not laughing at other people’s expense
I believe it’s hard to watch a lover leave
And when they’re gone all you can do is breath
I believe to always look on the bright side
I believe that life is just one big ride
I believe when I die people will grieve
But it’s ok because I believe"
340,Emotion,BelievePoemsToBelievePoembyKarinaLakeyeva,"You think that I just love to mope,
To mope, despond, cry & grieve.
But I see just you as my hope,
I trust you – yet do not believe.
You tell me a regular story –
Too fabulous for to perceive,
Too fabulous for me, I’m sorry…
I trust you but cannot believe.
Though I cannot call you a liar
Per se I expect you to leave
In doubts my soul, my fen-fire,
I trust you but hardly believe.
I used to rise then break in flinders,
I wear my heart on my sleeve.
Is it your or my flame that cinders?
I trust you but should I believe?
A hedgehog am I – cut my stickers
For waves in my hot chest to heave
So calm while my butterfly flickers,
I trust you and want to believe!"
341,Emotion,BelievePoemsIBelievePoembyLydieMathers,"I believe that there are times when no one person is wrong or right.
I believe that there are things in this world that are less important then holding your children tight.
I believe in love that is true.
I believe that all love has it's struggles but we make it through.
I believe that my children and yours are here to do wonderous things.
I believe that we should not hinder them but give them hope and wings.
I believe that God will see me through any storm.
I believe that every disfunctional family is the Norm.
I believe that death will greet us all one day.
I believe that I will not be scared and LIVE along the way.
I believe that life can pass us by unexpectedly.
I believe that some people will let it pass unemotionally.
I believe that there is always a way to get through.
But most of all I believe in Me as well as You."
342,Emotion,BelievePoemsIBelieveInLipstickStainsPoembychristiansalvador,"i believe in love letters and red roses
but i dont believe in us touching noses
i believe in those cheesy lines from those hollywood flicks
but i dont believe in us stealing kisses on the cheeks
i believe in things such as rules of engagement
but i dont believe in us building firm attachment
i believe in the pair of Mickey and Minnie mouse
but i dont belive in you being my spouse
i believe in sweethearts running on the shore
but i dont believe in us cuddling on the floor
i believe in blind dates and chemistry
but i dont believe in going out with you on the 14th of february
i believe in teddy bears and lipstick stains on the collar
but i dont believe in our relationship would go as far
i believe in carving names on the backyard tree
but i dont believe in the future of you and me
coz we once allowed ourselves to hold on and try
but you lose your grip easily and always turn out to goodbye
all those candy-coated things that love has
perhaps will never be applicable to us
i do have faith on paraphernalias of affection
just like i do have faith on divine intervention
i believe in forever and heartaches too
coz i believe in love but i dont believe in loving you"
343,Emotion,BelievePoemsIBelievePoembysamuelnze,"I believe I shall succeed
I believe I shall be an inspiration
I believe my troubles are temporary
I believe I shall be rich
I believe I shall swell wide
I believe I shall take on the world
I believe I shall speak of wealth
I believe I shall carry sufferers along
I believe I shall show how I made it from nothing
I believe in God
I believe that he is taking me somewhere
I believe that the darkness of today gives way
I believe, I believe, I believe."
344,Emotion,BelievePoemsIBelieveThatUPoembyjanardanbramhachari,"I don’t know what to do with out you …. But
I believe that you will guide me to finish my work
I believe that you will take me back to my home
I believe if I hurt you then you will forgive me
I believe you will sweet like my sugar candy
I don’t know what to do with out you …. But
I believe that u will light my dark nights by ur moon
I believe u will relief my thirsty by ur rain
I believe u will send me ur sun when I need him
I believe u will always flow ur cool wind that I can take breath
I don’t know what to do with out you …. But
I believe u will always watching me from ur place
I believe u will lift up me when I will fall down
I believe  u will make me that strong that I can lift up other
I believe u help me to let know other that u are with me"
345,Emotion,BelievePoemsIBelieveInMiraclesPoembyBillieJeanneJames,"I believe in rainbows and golden sunbeams
i believe in hopes and dreams
i believe in that old fable always told of old
That at the rainbows end there's a pot of gold
i believe there's some place beyond the blue
Where the promise of Love and Peace is forever true
i believe in me and you
i believe in miracles, for i have known a few
i believe in me and you
i believe in miracles, for i have known a few
i believe in me and you"
346,Emotion,BelievePoemsBelievePoembyMarwaRakha,"With the power of my thoughts I summoned you;
With a blink I made you vanish.
On a dark trip your spirit shall wander
and as it gets darker you shall believe in me.
Ungrateful creature, I am your heaven and haven;
Ingratitude is a sin, and sinners live an eternity in hell.
In mazes of confusion your spirit shall wander;
In utter darkness demons of the past shall haunt you;
Of happiness you are incapable
then you shall dwell in misery and isolation.
Have I not tried to befriend you?
Have I not held you and healed you?
But alas, you are just another ungrateful creature;
Reside in darkness and dwell in fear.. I thee curse.
Know me or know me not... I am a collector;
for when you were not looking,
in your core, I planted my seed.
Before you know it,
I shall grow in your soul
like a leafy tree of a hundred years."
347,Emotion,BelievePoemsIBelievePoembyPamFraser,"I believe in miracles.
and dreams that will come true.
I believe in tender moments.
I believe in reaching out,
and touching from the heart.
I believe that if we touch,
a gift we can pass on.
I believe that if you cry
your tears are not in vain.
when you're sad and lonely,
others know your pain.
I believe that when we laugh
a sparkle starts to shine,
and I just know that spark will spread
from more hearts than just mine.
I believe the gifts you have,
are there for you to share.
and when you give from the heart,
the whole world knows you care.
I believe that comfort comes
from giving part of me.
and if I share with others,
there's more for all to see.
I believe that love is still
the greatest gift of all.
and when it's given from the heart,
then not one of us will fall."
348,Emotion,BelievePoemsDoYouBelieveInFairiesPoembyJaniceWalkden,"Do you believe in fairies?
Could fairies really exist?
Do they live in flowers & gardens?
Do they play in the morning mists?
Do they tend to nature
With loving healing care
Do they fly through the forests
Would we see them there?
Are they oh so gentle?
Are they Heaven sent?
Do they fly  with the butterflies
until the day is spent?
Oh I would love to see them
To catch sight of them at play
Dancing around the flowers
just going about their day"
349,Emotion,BelievePoemsBelievePoembyAlixisWhitwer,"I don't believe in love
I don't believe in fairy tales
I believe in heartbreak
I believe in sad endings
I don't believe in happy endings
I don't believe in dreams
I believe in pain
I believe dreams are for sleeping"
350,Emotion,BelievePoemsIfOnlySheBelieveILoveHerPoembyDislocatedHeart,"music blasted in the air.
birds are flyin every where.
can you feel the love tonight
or is it just in my sight?
she loves me..
ohh.. yes she does..
can the moon not be brighter to match that smile on her face.
could the sun dim just a bit so i can look up and look back at her and say damn your hot.
she is my world.
nothing can compare to how im feeling.
this is just the way i wanna tell her.
i love her.
if only she knew.
i would write my heart out to her.
i would sing her a song.
i would tell her stories.
i would look her in the eyes and say,
babe i love you.
if only she believe the words coming out of my mouth.
she would know,
im lost in her eyes,
i wont find my way out.
im lost in her world,
i gotta stay somehow.
i love her.
if only she knew.
if only she believed.
i love her."
351,Emotion,BelievePoemsAnotherTruthDonTReadThisIfYouDonTBelieveInGodPoembyEgalBohen,"If you believe in God
God must have made us all
Out of whatever God is
Unless God borrowed something small
From some other God, perhaps a friend of his
Or, he may have had a brother or a sister or two
Though this is unlikely and probably not true
Because it would mean, that he was in that case
Just one of  two or three Gods out there in space
Raising the question of who was there first
Where did the others come from?
Perhaps near Chislelhurst?
And then one could ask, where did the others go?
But that's a very difficult question to answer, you know
Which means in the end  you surely must perceive
If you believe in one God
He is in you and me
For whatever God is
You is a part
(Actually, ... I think, ....he lives in your heart)"
352,Emotion,BelievePoemsIHaveTriedBelieveMePoembyStellaSisandaQishi,"i have tried blocking my ears
while he called you things you were not,
but the epithets were heart-rending
i have tried looking away
while he beat you up
but your doleful screams of help
held me back
i have tried calling 10111
but the line just went dead
i have tried defending you
but my arms just went numb
i have tried callind 10177
but they were out of ambulances
i have tried calling your neighbour, too
but he went fishing that day
and the lads across the street
they went boozing
i have tried reasoning with him
but he called me an outsider
your sister was in labour
your mother lay sick abed
your brother ducking and diving in Darfur
your father partying at club Numbers
so i locked myself in my room
hoping that God's mercy would intervene
and now as i stand above
your lifeless body bathed in blood
i curse myself for my helplessness
but believe me, i have tried!"
353,Emotion,BelievePoemsIWantIWishToBelievePoembyTsiraGogeshvili,"I want – I wish to believe
The old tale’s – the ballad’s words,
How the sunny knight cuts
The monsters nine heads off…
Just at one stroke of his sword!"
354,Emotion,BelievePoemsBelieveWhatYouBelieveBecauseWhatYouBelieveIsWhatYouBelieveJoshuaAaronGuilloryPoembyJoshuaAaronGuillory,Believe what you believe because what you believe is what you believe. - Joshua Aaron Guillory
355,Emotion,BelievePoemsBelieveInHumanityPoembyUriahHamilton,"You can dance
Like a drunk
In the summer night,
Laugh with strangers
In the moonlight,
Gaze at girls
That walk in the red light,
Say prayers at hillside shrines
To Shinto Deities
That your parents
Never knew.
Everything is a combination
Of misery and poetry.
You have to swim
In a lake of suffering
To reach the shore
Of self-knowledge
About the reason
You’re living for.
I’m living to sing
A tender song at dawn
That will break God’s heart:
I want to make him
Linger here in tears
Until he helps us along
This sad journey
That we’re traveling upon.
I believe in Divinity
And I need for Divinity
To believe in humanity."
356,Emotion,BelievePoemsIBelieveInFairyTalesPoembybeastofburden,"Riding on the backs of giant snails
Ships with cotton candy sails
Iridescent castles, bubble blown
Mountains made of chocolate scones
Pigs that fly upside down in the sky
The moon at night made of cream pie
Riding through the sky on dragon tails
Sunbathing on the backs of whales
I believe in all these things
Even the lullabies a unicorn sings"
