,topic,file,text
125,Emotion,DreamPoemsASwimmersDreamPoembyAlgernonCharlesSwinburne,"Somno mollior unda
I
Dawn is dim on the dark soft water,
Soft and passionate, dark and sweet.
Love's own self was the deep sea's daughter,
Fair and flawless from face to feet,
Hailed of all when the world was golden,
Loved of lovers whose names beholden
Thrill men's eyes as with light of olden
Days more glad than their flight was fleet.
So they sang: but for men that love her,
Souls that hear not her word in vain,
Earth beside her and heaven above her
Seem but shadows that wax and wane.
Softer than sleep's are the sea's caresses,
Kinder than love's that betrays and blesses,
Blither than spring's when her flowerful tresses
Shake forth sunlight and shine with rain.
All the strength of the waves that perish
Swells beneath me and laughs and sighs,
Sighs for love of the life they cherish,
Laughs to know that it lives and dies,
Dies for joy of its life, and lives
Thrilled with joy that its brief death gives -
Death whose laugh or whose breath forgives
Change that bids it subside and rise.
II
Hard and heavy, remote but nearing,
Sunless hangs the severe sky's weight,
Cloud on cloud, though the wind be veering
Heaped on high to the sundawn's gate.
Dawn and even and noon are one,
Veiled with vapour and void of sun;
Nought in sight or in fancied hearing
Now less mighty than time or fate.
The grey sky gleams and the grey seas glimmer,
Pale and sweet as a dream's delight,
As a dream's where darkness and light seem dimmer,
Touched by dawn or subdued by night.
The dark wind, stern and sublime and sad,
Swings the rollers to westward, clad
With lustrous shadow that lures the swimmer,
Lures and lulls him with dreams of light.
Light, and sleep, and delight, and wonder,
Change, and rest, and a charm of cloud,
Fill the world of the skies whereunder
Heaves and quivers and pants aloud
All the world of the waters, hoary
Now, but clothed with its own live glory,
That mates the lightning and mocks the thunder
With light more living and word more proud.
III
Far off westward, whither sets the sounding strife,
Strife more sweet than peace, of shoreless waves whose glee
Scorns the shore and loves the wind that leaves them free,
Strange as sleep and pale as death and fair as life,
Shifts the moonlight-coloured sunshine on the sea.
Toward the sunset's goal the sunless waters crowd,
Fast as autumn days toward winter: yet it seems
Here that autumn wanes not, here that woods and streams
Lose not heart and change not likeness, chilled and bowed,
Warped and wrinkled: here the days are fair as dreams.
IV
O russet-robed November,
What ails thee so to smile?
Chill August, pale September,
Endured a woful while,
And fell as falls an ember
From forth a flameless pile:
But golden-girt November
Bids all she looks on smile.
The lustrous foliage, waning
As wanes the morning moon,
Here falling, here refraining,
Outbraves the pride of June
With statelier semblance, feigning
No fear lest death be soon:
As though the woods thus waning
Should wax to meet the moon.
As though, when fields lie stricken
By grey December's breath,
These lordlier growths that sicken
And die for fear of death
Should feel the sense requicken
That hears what springtide saith
And thrills for love, spring-stricken
And pierced with April's breath.
The keen white-winged north-easter
That stings and spurs thy sea
Doth yet but feed and feast her
With glowing sense of glee:
Calm chained her, storm released her,
And storm's glad voice was he:
South-wester or north-easter,
Thy winds rejoice the sea.
V
A dream, a dream is it all -  the season,
The sky, the water, the wind, the shore?
A day-born dream of divine unreason,
A marvel moulded of sleep -  no more?
For the cloudlike wave that my limbs while cleaving
Feel as in slumber beneath them heaving
Soothes the sense as to slumber, leaving
Sense of nought that was known of yore.
A purer passion, a lordlier leisure,
A peace more happy than lives on land,
Fulfils with pulse of diviner pleasure
The dreaming head and the steering hand.
I lean my cheek to the cold grey pillow,
The deep soft swell of the full broad billow,
And close mine eyes for delight past measure,
And wish the wheel of the world would stand.
The wild-winged hour that we fain would capture
Falls as from heaven that its light feet clomb,
So brief, so soft, and so full the rapture
Was felt that soothed me with sense of home.
To sleep, to swim, and to dream, for ever -
Such joy the vision of man saw never;
For here too soon will a dark day sever
The sea-bird's wing from the sea-wave's foam.
A dream, and more than a dream, and dimmer
At once and brighter than dreams that flee,
The moment's joy of the seaward swimmer
Abides, remembered as truth may be.
Not all the joy and not all the glory
Must fade as leaves when the woods wax hoary;
For there the downs and the sea-banks glimmer,
And here to south of them swells the sea."
126,Emotion,DreamPoemsTheDreamOfThoseDaysPoembyThomasMoore,"The dream of those days when first I sung thee is o'er
Thy triumph hath stain'd the charm thy sorrows then wore;
And even the light which Hope once shed o'er thy chains,
Alas, not a gleam to grace thy freedom remains.
Say, is it that slavery sunk so deep in thy heart,
That still the dark brand is there, though chainless thou art;
And Freedom's sweet fruit, for which thy spirit long burn'd,
Now, reaching at last thy lip, to ashes hath turn'd?
Up Liberty's steep by Truth and Eloquence led,
With eyes on her temple fix'd, how proud was thy tread!
Ah, better thou ne'er hadst lived that summit to gain,
Denied in the porch, than thus dishonour the fane."
127,Emotion,DreamPoemsAnInstructorsDreamPoembyBillKnott,"Many decades after graduation
the students sneak back onto
the school-grounds at night
and within the pane-lit windows
catch me their teacher at the desk
or blackboard cradling a chalk:
someone has erased their youth,
and as they crouch closer to see
more it grows darker and quieter
than they have known in their lives,
the lesson never learned surrounds
them; why have they come? Is
there any more to memorize now
at the end than there was then""
What is it they peer at through shades
of time to hear, X times X repeated,
my vain efforts to corner a room's
snickers? Do they mock me? Forever?
Out there my past has risen in
the eyes of all my former pupils but
I wonder if behind them others
younger and younger stretch away
to a world where dawn will never
ring its end, its commencement bell."
128,Emotion,DreamPoemsTheFirstLoveDreamPoembyHenryClayWork,"Last night, mother, he told me so,
As we walked by the pebbly stream;
And I wake so happy--so wild with joy,
It seems like a fairy dream.
But his charming voice is ringing in my ear,
As a dream voice chould not be--
He's the best man, you know, in the whole wide world,
And he loves--he only love me.
Kiss me, mother, and share the joy
That has on my fortune smiled;
You have shared myu sorrows when e'er I wept,
Since I was a little child
Do you chide me now? what could your darling do,
When he pleads with bended knee?
He's the best man, you know, in the whole wide world,
And he loves--he only loves me.
Leave you, mother, it brings a pang
To this light and bounding heart;
But if he were calling, the bride would go,
Tho' you and the daughter part.
At a word from him, a beckon of his hand,
I would cross the rolling sea--
He's the best man, you know, in the whole wide world,
And he loves--he only loves me."
129,Emotion,DreamPoemsADreamWithinADreamPoembyEdgarAllanPoe,"Take this kiss upon the brow!
And, in parting from you now,
Thus much let me avow-
You are not wrong, who deem
That my days have been a dream;
Yet if hope has flown away
In a night, or in a day,
In a vision, or in none,
Is it therefore the less gone?
All that we see or seem
Is but a dream within a dream.
I stand amid the roar
Of a surf-tormented shore,
And I hold within my hand
Grains of the golden sand-
How few! yet how they creep
Through my fingers to the deep,
While I weep- while I weep!
O God! can I not grasp
Them with a tighter clasp?
O God! can I not save
One from the pitiless wave?
Is all that we see or seem
But a dream within a dream?"
130,Emotion,DreamPoemsTheDreamIDaredNotDreamPoembyDavidZvekic,"I've lost the joy that used to meet your smile,
And found without its light my life now feels
That I have squandered love; It takes a while
Before faith's misconception hurts as real.
In emptiness your voice leaves sounds untouched;
The tones and memories of brighter days.
If I had only known I loved you this much,
I'd not have lost the light for darker ways.
Where secrets hide beneath a stoic voice,
The fear which bars your music soft from me,
I can not bear this hurt, but have no choice;
The dream I dared not dream means such to me.
I can not see nor hear that which I know,
But blinded thus, I dare not let love go.
-August 26,2005"
131,Emotion,DreamPoemsTheBergADreamPoembyHermanMelville,"I saw a ship of material build
(Her standards set, her brave apparel on)
Directed as by madness mere
Against a solid iceberg steer,
Nor budge it, though the infactuate ship went down.
The impact made huge ice-cubes fall
Sullen in tons that crashed the deck;
But that one avalanche was all--
No other movement save the foundering wreck.
Along the spurs of ridges pale,
Not any slenderest shaft and frail,
A prism over glass-green gorges lone,
Toppled; or lace or traceries fine,
Nor pendant drops in grot or mine
Were jarred, when the stunned ship went down.
Nor sole the gulls in cloud that wheeled
Circling one snow-flanked peak afar,
But nearer fowl the floes that skimmed
And crystal beaches, felt no jar.
No thrill transmitted stirred the lock
Of jack-straw neddle-ice at base;
Towers indermined by waves--the block
Atilt impending-- kept their place.
Seals, dozing sleek on sliddery ledges
Slipt never, when by loftier edges
Through the inertia ovrthrown,
The impetuous ship in bafflement went down.
Hard Berg (methought), so cold, so vast,
With mortal damps self-overcast;
Exhaling still thy dankish breath--
Adrift dissolving, bound for death;
Though lumpish thou, a lumbering one--
A lumbering lubbard loitering slow,
Impingers rue thee ad go slow
Sounding thy precipice below,
Nor stir the slimy slug that sprawls
Along thy dead indifference of walls."
132,Emotion,DreamPoemsTheDreamPoembyAphraBehn,"All trembling in my arms Aminta lay,
Defending of the bliss I strove to take;
Raising my rapture by her kind delay,
Her force so charming was and weak.
The soft resistance did betray the grant,
While I pressed on the heaven of my desires;
Her rising breasts with nimbler motions pant;
Her dying eyes assume new fires.
Now to the height of languishment she grows,
And still her looks new charms put on;
– Now the last mystery of Love she knows,
We sigh, and kiss: I waked, and all was done.
`Twas but a dream, yet by my heart I knew,
Which still was panting, part of it was true:
Oh how I strove the rest to have believed;
Ashamed and angry to be undeceived!"
133,Emotion,DreamPoemsADreamOfFoxesPoembyLucilleClifton,"fox
who
can blame her for hunkering
into the doorwells at night,
the only blaze in the dark
the brush of her hopeful tail,
the only starlight
her little bared teeth?
and when she is not satisfied
who can blame her for refusing to leave,
Master Of The Hunt, why am i
not feeding, not being fed?
the coming of fox
one evening i return
to a red fox
haunched by my door.
i am afraid
although she knows
no enemy comes here.
next night again
then next then next
she sits in her safe shadow
silent as my skin bleeds
into long bright flags
of fur.
dear fox
it is not my habit
to squat in the hungry desert
fingering stones, begging them
to heal, not me but the dry morninngs
and bitter nights.
it is not your habit
to watch, none of this
is ourrs, sister fox.
tell yourself that anytime now
we will rise and walk away
from somebody else's life.
any time.
leaving fox
so many fuckless days and nights
only the solitary fox
watching my window light
barks her compassion.
i move away from her eyes.
from the pitying brush
of her tail
to a new place and check
for signs. so far
i am the only animal.
i will keep the door unlocked
until something human comes.
one year later
what if,
then,
entering my room,
brushing against the shadows,
lapping them into rust,
her soft paw extended,
she had called me out?
what if,
then,
i had reared up baying,
and followed her off
into vixen country?
what then of the moon,
the room, the bed, the poetry
of regret?
a dream of foxes
in the dream of foxes
there is a field
and a procession of women
clean as good children
no hollow in the world
surrounded by dogs
no fur clumped bloody
on the ground
only a lovely line
of honest women stepping
without fear or guilt or shame
safe through the generous fields."
134,Emotion,DreamPoemsYouDreamALittleDreamOfMePoembyShaunCronick,"You dream a little dream of me,
When you close your eyes.
A promise kept to remember,
So part of me never dies.
You dream a little dream of me,
Of when we were together.
Happy memories so resilient,
From all life's stormy weather.
You dream a little dream of me,
Now so sadly on your own.
But I return to softly whisper,
In dreams you're never alone."
135,Emotion,DreamPoemsTheDreamPoembyJohnDonne,"Dear love, for nothing less than thee
Would I have broke this happy dream;
It was a theme
For reason, much too strong for phantasy:
Therefore thou waked'st me wisely; yet
My dream thou brok'st not, but continued'st it.
Thou art so truth that thoughts of thee suffice
To make dreams truths, and fables histories.
Enter these arms, for since thou thought'st it best
Not to dream all my dream, let's act the rest.
As lightning or a taper's light,
Thine eyes, and not thy noise, waked me;
Yet I thought thee
(For thou lov'st truth)  an angel at first sight;
But when I saw thou saw'st my heart,
And knew'st my thoughts, beyond an angels art,
When thou knew'st what I dreamt, when thou knew'st when
Excess of joy would wake me, and cam'st then,
I must confess it could not choose but be
Prophane to think thee anything but thee.
Comming and staying showed thee thee,
But rising makes me doubt, that now
Thou art not thou.
That Love is weak, where fear's as strong as he;
'Tis not all spirit pure and brave
If mixture it of Fear, Shame, Honour, have.
Perchance as torches, which must ready be,
Men light and put out, so thou deal'st with me,
Thou cam'st to kindle, go'st to come; Then I
Will dream that hope again, but else would die."
136,Emotion,DreamPoemsADreamADreamPoembyMatthewPetranovich,"A dream, A dream,
another dream.
A dream of you,
A dream of love,
A dream of you and me,
we had such chemistry,
If only you could see.
A dream we danced in the moonlight,
A dream we made love til the mornings bright light,
A dream, A dream,
Where my true feeling burst,
A dream, A dream
Makes me feel more hurt.
A dream, A dream,
of true love,
over and over,
over and over,
A dream, A dream
where we are together,
A dream, A dream,
why can't it be real,
A dream, A dream,
where really connect,
A dream, A dream
that I can't reject,
A dream, A dream,
and another dream,
Why can't it be real?
Why can't you love me?"
137,Emotion,DreamPoemsADreamIsADreamPoembyRebeccaRyan,"A dream is a dream.
Some dreams can come true,
and some cannot.
How you attempt to achieve that goal,
your dream, it is up to you.
A dream is a dream.
Some are based on things that have happened.
Some are what you wish to happen.
We've all heard the song, 'A Dream is a Wish Your Heart Makes.'
That is true.
A dream is a dream.
It can come true if you just believe.
Believe in your heart,
Believe in your soul,
Believe that you CAN achieve your goal.
And that dream WILL come true.
A dream is a dream."
138,Emotion,DreamPoemsDreamALittleDreamForMePoembyJackHarris,"At night when you think through your day
Think on the things that you did say
When you think through the things that you should be
Dream this little dream for me
Dream of blue skies forever
Dream that we are a worthy endeavor
Dream this one dream so you can see
Dream this little dream for me
The world fades but I'm still here
Still living for you
I'm sitting outside beneath the sky clear
Just enjoying your view
Sleep well until morning comes
Live with the passion of a thousand suns
Tell me all the things that you should be
And dream this little dream for me
Dream of you through my eyes
Dream though it may not be much of a surprise
That while you dream enjoying the view
I'm dreaming a little dream for you.
Yes, dreaming a dream for you!"
139,Emotion,DreamPoemsIDreamDInADreamPoembyWaltWhitman,"I DREAM'D in a dream, I saw a city invincible to the attacks of the
whole of the rest of the earth;
I dream'd that was the new City of Friends;
Nothing was greater there than the quality of robust love--it led the
rest;
It was seen every hour in the actions of the men of that city,
And in all their looks and words."
140,Emotion,DreamPoemsDreamGirlPoembyCarlSandburg,"You will come one day in a waver of love,
Tender as dew, impetuous as rain,
The tan of the sun will be on your skin,
The purr of the breeze in your murmuring speech,
You will pose with a hill-flower grace.
You will come, with your slim, expressive arms,
A poise of the head no sculptor has caught
And nuances spoken with shoulder and neck,
Your face in a pass-and-repass of moods
As many as skies in delicate change
Of cloud and blue and flimmering sun.
Yet,
You may not come, O girl of a dream,
We may but pass as the world goes by
And take from a look of eyes into eyes,
A film of hope and a memoried day."
141,Emotion,DreamPoemsDreamOrNoDreamPoembyPranabKChakraborty,"stands she alone on the horizon
white her cloths blowing with mad rapture
long her airy hair playing to be off of the root
full moon strangles the surroundings to make it cry
cry not to get any another dawn
the sphinx as a look of behind chapters
the past never shows us the light
what lamped the imprisoned nymphs
night after night the whip the paws
the chiseling passion of the crown
marked their cracks their gallons of stallionic gallops
flooded the birth of enslaved curse
now glitter to revenge from ground to growth
moonlit night...
night scratches the certain rest
with the nails of horrible uncertain
flagging the smoke the dirt of dirty inhuman
possibly pissing their ancestors
locked in the volt iron-hard
to keep the way clear
to keep the root untouchable
stands she alone on the horizon
I as a sphinx  simply with blunt eyes
look beyond this dreamed night the age another
the days without death by dominating thumb
the life without fear the fear to be enslaved
shout without sound I again offer my soul
to the mighty mightier than that she stands alone
don't illuminate thy shine to shine the surroundings
gets dark its dawn with sigh and shadows of living dier
never
never
never
Pranab k c
09/07/2012"
142,Emotion,DreamPoemsTheDreamPoembyAmyLevy,"Believe me, this was true last night,
Tho' it is false to-day.
-  A.M.F. Robinson.
A fair dream to my chamber flew:
Such a crowd of folk that stirred,
Jested, fluttered; only you,
You alone of all that band,
Calm and silent, spake no word.
Only once you neared my place,
And your hand one moment's space
Sought the fingers of my hand;
Your eyes flashed to mine; I knew
All was well between us two.
* * * * *
On from dream to dream I past,
But the first sweet vision cast
Mystic radiance o'er the last.
* * * * *
When I woke the pale night lay
Still, expectant of the day;
All about the chamber hung
Tender shade of twilight gloom;
The fair dream hovered round me, clung
To my thought like faint perfume:-
Like sweet odours, such as cling
To the void flask, which erst encloses
Attar of rose; or the pale string
Of amber which has lain with roses."
143,Emotion,DreamPoemsADreamPangPoembyRobertFrost,"I had withdrawn in forest, and my song
Was swallowed up in leaves that blew alway;
And to the forest edge you came one day
(This was my dream) and looked and pondered long,
But did not enter, though the wish was strong:
You shook your pensive head as who should say,
‘I dare not—too far in his footsteps stray—
He must seek me would he undo the wrong.
Not far, but near, I stood and saw it all
Behind low boughs the trees let down outside;
And the sweet pang it cost me not to call
And tell you that I saw does still abide.
But ’tis not true that thus I dwelt aloof,
For the wood wakes, and you are here for proof."
144,Emotion,DreamPoemsADreamWithinADreamPoembyjohntiongchunghoo,"as i close my eyes
a blackhole looms
this inner  world
a torment it brings
how far does it goes
each night as i sleep
where do i journey to
this dark realm
which for forty-five years
i have travelled each night
never reaching any place
sometimes it throws a dream
a dream where i am
but somebody different from i am
talking like an indian
sometimes it throws a dream
a dream where mom
keeps so quiet
in a never seen house
so much grander
yes, as i live on
i travel each night
in a black hoe
ticking away to a foreign land
year after year
a land which i could not grasp
but accept it with each of my breath
time keeps ticking away
each second, a second
nearer to the day of death
where perhaps i would continue
in this journey in the blackhoe
and perhaps find light in it
in two worlds
i travel, consciously
and subconsciously
in a ship that i control
and being controlled
the master and also the slave
i look into the night sky
and realise that
in this trip i am but
an observer of
a real world and imagined
a film where i partake
each day with no known script
i consider myself the greatest actor in this case
enacting each scene
with a full heart and soul
pain and all
perhaps somewhere out there
someone out there
is enjoying it all
the fact that i control as well as
is controlled by my own life, cells...."
145,Emotion,DreamPoemsHisDreamPoembyWilliamButlerYeats,"I swayed upon the gaudy stem
The butt-end of a steering-oar,
And saw wherever I could turn
A crowd upon a shore.
And though I would have hushed the crowd,
There was no mother's son but said,
""What is the figure in a shroud
Upon a gaudy bed?'
And after running at the brim
Cried out upon that thing beneath
- It had such dignity of limb -
By the sweet name of Death.
Though I'd my finger on my lip,
What could I but take up the song?
And running crowd and gaudy ship
Cried out the whole night long,
Crying amid the glittering sea,
Naming it with ecstatic breath,
Because it had such dignity,
By the sweet name of Death."
146,Emotion,DreamPoemsDreamDeferredPoembyLangstonHughes,"What happens to a dream deferred?
Does it dry up
Like a raisin in the sun?
Or fester like a sore--
And then run?
Does it stink like rotten meat?
Or crust and sugar over--
like a syrupy sweet?
Maybe it just sags
like a heavy load.
Or does it explode?"
147,Emotion,DreamPoemsADreamWithinADreamPoembyDEEPDARKSOULPOET,"A dream within a dream,
So lonely in the winter still;
Wishes going into the air stream,
To never again to fulfil.
A dream within loneliness,
The moments we once had;
The day is now flowerless,
Down this entire winter pad.
A dream within a stone,
So hard and cold of all;
The feeling when we are alone,
A day or two of appal.
A dream within the past,
From nights that were before;
The thoughts that didn't last,
And therefore are no more.
A dream within a reach,
That once was staying here;
And nothing left to teach,
Or nothing gave to share.
A dream within a thought,
That we once knew of some;
But time moved on or bought,
And never again is to come."
148,Emotion,DreamPoemsDreamBarkerPoembyJeanValentine,"We met for supper in your flat-bottomed boat.
I got there first:   in a white dress:   I remember
Wondering if you'd come.   Then you shot over the bank,
A Virgilian Nigger Jim, and poled us off
To a little sea-food barker's cave you knew.
What'll you have? you said.   Eels hung down,
Bamboozled claws hung up from the crackling weeds.
The light was all behind us.   To one side
In a dish of ice was a shell shaped like a sand-dollar
But worked with Byzantine blue and gold.   What's that?
Well, I've never seen it before, you said,
And I don't know how it tastes.
Oh well, said I, if it's bad,
I'm not too hungry, are you? We'd have the shell...
I know just how you feel, you said.
And asked for it; we held out our hands.
Six Dollars! barked the barker, For This Beauty!
We fell down laughing in your flat-bottomed boat, .
And then I woke up:   in a white dress:
Dry as a bone on dry land, Jim,
Bone dry, old, in a dry land, Jim, my Jim. ."
149,Emotion,DreamPoemsADreamPoembyWilliamAllingham,"I heard the dogs howl in the moonlight night;
I went to the window to see the sight;
All the Dead that ever I knew
Going one by one and two by two.
On they pass'd, and on they pass'd;
Townsfellows all, from first to last;
Born in the moonlight of the lane,
Quench'd in the heavy shadow again.
Schoolmates, marching as when they play'd
At soldiers once - but now more staid;
Those were the strangest sight to me
Who were drown'd, I knew, in the awful sea.
Straight and handsome folk, bent and weak, too;
Some that I loved, and gasp'd to speak to;
Some but a day in their churchyard bed;
Some that I had not known were dead.
A long, long crowd - where each seem'd lonely,
Yet of them all there was one, one only,
Raised a head or look'd my way;
She linger'd a moment - she might not stay.
How long since I saw that fair pale face!
Ah! Mother dear! might I only place
My head on thy breast, a moment to rest,
While thy hand on my tearful cheek were prest!
On, on, a moving bridge they made
Across the moon-stream, from shade to shade,
Young and old, women and men;
Many long-forgot, but remembered then,
And first there came a bitter laughter;
A sound of tears a moment after;
And then a music so lofty and gay,
That eve morning, day by day,
I strive to recall it if I may."
