,topic,file,text
459,Emotion,RomancePoemsRomanceModernePoembyWilliamCarlosWilliams,"Tracks of rain and light linger in
the spongy greens of a nature whose
flickering mountain--bulging nearer,
ebbing back into the sun
hollowing itself away to hold a lake,--
or brown stream rising and falling at the roadside, turning about,
churning itself white, drawing
green in over it,--plunging glassy funnels
fall--
And--the other world--
the windshield a blunt barrier:
Talk to me. Sh! they would hear us.
--the backs of their heads facing us--
The stream continues its motion of
a hound running over rough ground.
Trees vanish--reappear--vanish:
detached dance of gnomes--as a talk
dodging remarks, glows and fades.
--The unseen power of words--
And now that a few of the moves
are clear the first desire is
to fling oneself out at the side into
the other dance, to other music.
Peer Gynt. Rip Van Winkle. Diana.
If I were young I would try a new alignment--
alight nimbly from the car, Good-bye!--
Childhood companions linked two and two
criss-cross: four, three, two, one.
Back into self, tentacles withdrawn.
Feel about in warm self-flesh.
Since childhood, since childhood!
Childhood is a toad in the garden, a
happy toad. All toads are happy
and belong in gardens. A toad to Diana!
Lean forward. Punch the steerman
behind the ear. Twirl the wheel!
Over the edge! Screams! Crash!
The end. I sit above my head--
a little removed--or
a thin wash of rain on the roadway
--I am never afraid when he is driving,--
interposes new direction,
rides us sidewise, unforseen
into the ditch! All threads cut!
Death! Black. The end. The very end--
I would sit separate weighing a
small red handful: the dirt of these parts,
sliding mists sheeting the alders
against the touch of fingers creeping
to mine. All stuff of the blind emotions.
But--stirred, the eye seizes
for the first time--The eye awake!--
anything, a dirt bank with green stars
of scrawny weed flattened upon it under
a weight of air--For the first time!--
or a yawning depth: Big!
Swim around in it, through it--
all directions and find
vitreous seawater stuff--
God how I love you!--or, as I say,
a plunge into the ditch. The End. I sit
examining my red handful. Balancing
--this--in and out--agh.
Love you? It's
a fire in the blood, willy-nilly!
It's the sun coming up in the morning.
Ha, but it's the grey moon too, already up
in the morning. You are slow.
Men are not friends where it concerns
a woman? Fighters. Playfellows.
White round thighs! Youth! Sighs--!
It's the fillip of novelty. It's--
Mountains. Elephants humping along
against the sky--indifferent to
light withdrawing its tattered shreds,
worn out with embraces. It's
the fillip of novelty. It's a fire in the blood.
Oh get a flannel shirt, white flannel
or pongee. You'd look so well!
I married you because I liked your nose.
I wanted you! I wanted you
in spite of all they'd say--
Rain and light, mountain and rain,
rain and river. Will you love me always?
--A car overturned and two crushed bodies
under it.--Always! Always!
And the white moon already up.
White. Clean. All the colors.
A good head, backed by the eye--awake!
backed by the emotions--blind--
River and mountain, light and rain--or
rain, rock, light, trees--divided:
rain-light counter rocks-trees or
trees counter rain-light-rocks or--
Myriads of counter processions
crossing and recrossing, regaining
the advantage, buying here, selling there
--You are sold cheap everywhere in town!--
lingering, touching fingers, withdrawing
gathering forces into blares, hummocks,
peaks and rivers--rivers meeting rock
--I wish that you were lying there dead
and I sitting here beside you.--
It's the grey moon--over and over.
It's the clay of these parts."
460,Emotion,RomancePoemsButterfliesFlowersRomancePoembyNoelHorlanda,"Multicolored monarch fly,
Flower to flower vie,
Tipples nectar,
While I play guitar
Flowers everyday,
For a buxom young lady,
You and I ready,
For a lusty romance
Kisses cheek to cheek,
The dame and I at the peak,
To pick on, pick
Yellow red daisies n’ garden
Flowers I seek,
Roses and candle stick,
Athirst to smooch and flick,
For sweet red lips
Flowers n’ tears, monarch departs,
You and I aren’t apart,
For true love had start,
Promises not to part"
461,Emotion,RomancePoemsLovesApparitionAndEvanishmentAnAllegoricRomancePoembySamuelTaylorColeridge,"Like a lone Arab, old and blind,
Some caravan had left behind,
Who sits beside a ruin'd well,
Where the shy sand-asps bask and swell;
And now he hangs his ag{'e}d head aslant,
And listens for a human sound--in vain!
And now the aid, which Heaven alone can grant,
Upturns his eyeless face from Heaven to gain;--
Even thus, in vacant mood, one sultry hour,
Resting my eye upon a drooping plant,
With brow low-bent, within my garden-bower,
I sate upon the couch of camomile;
And--whether 'twas a transient sleep, perchance,
Flitted across the idle brain, the while
I watch'd the sickly calm with aimless scope,
In my own heart; or that, indeed a trance,
Turn'd my eye inward--thee, O genial Hope,
Love's elder sister! thee did I behold
Drest as a bridesmaid, but all pale and cold,
With roseless cheek, all pale and cold and dim,
Lie lifeless at my feet!
And then came Love, a sylph in bridal trim,
And stood beside my seat;
She bent, and kiss'd her sister's lips,
As she was wont to do;--
Alas! 'twas but a chilling breath
Woke just enough of life in death
To make Hope die anew."
462,Emotion,RomancePoemsfindingLoveInRomancePoembyChristophersDead,"She said that one day she might come back
But this is how it's been for years
I walk on tight ropes and stay too close to the glass
And I hide from my greatest fears
Well I'm done, with holding one
I'm hanging up, the will is gone
Tomorrow brings, a new religion
Yeah you can say I'm taking this one for me
I took a day out to remember
Just the way it felt, the sun and the air
I rode for hours following the train tracks
Until the sky said, yeah it's time to leave
And there I felt, a sudden bolt
Of static life, and electric soul
Today I feel, I can carry on
Love and life came back to sing their song
Can you remember the way it felt
Can't you feel the fire burning
Yes can't you reveal to me how this
Never-ending love could have failed
Well here's to you ‘cause I'm moving on
I lay out sprawled upon the sand
And I know that this is who I want to be
I hear the waves crashing onto the shore
This life-long renewal has new meaning"
463,Emotion,RomancePoemsRomanceInYourPantsPoembyTradeMartin,"Romance In Your Pants….,
Most times you can tell….,
With only a glance….,
But love can’t advance…..,
Unless you take the chance….,
And proceed to dance…..! ! !
So whatever sex you may be….,
I know you’ll handle it gracefully….,
Cause no matter what the circumstance….,
There’s no doubt…..,
That you’ve got Romance In Your Pants….! ! !
."
464,Emotion,RomancePoemsWatersOfRomancePoembyJoyceHemsley,"A letter to his love:
Meet me tonight by the water of dreams
In the moonlight ~ this is my plea.
Your charms fuel my longing for romance
Oh how I cling to the beauty of thee.
In love I shall be for eternity
So treasure this heaven and patient be
Often my eyes are moist with tears
As I sift through old pictures and souvenirs.
Let us walk and talk by the water's edge
On the sands down at Cascade Bay.
In the calm of night our hearts may unite
And over the sea we could sail away.
Our love would then be a beautiful song
Caresses adding to passion's fire.
Pure as the morning waters that flow
And as pleasant as lingering desire.
Promise you'll be there ~ to start anew.
I'll hold you close in the old-fashioned way.
By rivers and streams, as moonlight beams
We will add to the memories of yesterday."
465,Emotion,RomancePoemsRomancePoembyAndrewLang,"MY Love dwelt in a Northern land.
A gray tower in a forest green
Was hers, and far on either hand
The long wash of the waves was seen,
And leagues on leagues of yellow sand,
The woven forest boughs between!
And through the silver Northern night
The sunset slowly died away,
And herds of strange deer, lily-white,
Stole forth among the branches gray;
About the coming of the light,
They fled like ghosts before the day!
I know not if the forest green
Still girdles round that castle gray;
I know not if the boughs between
The white deer vanish ere the day;
Above my Love the grass is green,
My heart is colder than the clay!"
466,Emotion,RomancePoemsRomancePoembyEdgarAllanPoe,"Romance, who loves to nod and sing,
With drowsy head and folded wing,
Among the green leaves as they shake
Far down within some shadowy lake,
To me a painted paroquet
Hath been- a most familiar bird-
Taught me my alphabet to say-
To lisp my very earliest word
While in the wild wood I did lie,
A child- with a most knowing eye.
Of late, eternal Condor years
So shake the very Heaven on high
With tumult as they thunder by,
I have no time for idle cares
Through gazing on the unquiet sky.
And when an hour with calmer wings
Its down upon my spirit flings-
That little time with lyre and rhyme
To while away- forbidden things!
My heart would feel to be a crime
Unless it trembled with the strings."
467,Emotion,RomancePoemsRomancePoembyClaudeMcKay,"To clasp you now and feel your head close-pressed,
Scented and warm against my beating breast;
To whisper soft and quivering your name,
And drink the passion burning in your frame;
To lie at full length, taut, with cheek to cheek,
And tease your mouth with kisses till you speak
Love words, mad words, dream words, sweet senseless words,
Melodious like notes of mating birds;
To hear you ask if I shall love always,
And myself answer: Till the end of days;
To feel your easeful sigh of happiness
When on your trembling lips I murmur: Yes;
It is so sweet. We know it is not true.
What matters it? The night must shed her dew.
We know it is not true, but it is sweet --
The poem with this music is complete."
468,Emotion,RomancePoemsRomanceWithDemocracy2PoembyRatnakarMandlik,"The era of romance, its beginning.
Dice used by the players was startling
In the game of numbers on chess board
To tilt the power house and it's record.
Hottest commodity than gem or platinum
Turncoats were costliest in the millenium.
A keep of treachery had become wisdom
Criminalization of politics was in blossum.
Ethics, morality became out of fashion,
New tricks were evolved by imagination.
Merit and efficiency were then displaced.
Money and muscle power to them replaced.
No one can fool all for all the times,
Players had forgotten this truth supreme.
Poet:  Ratnakar D  Mandlik"
469,Emotion,RomancePoemsSexyYouRomancePoembyJamesMcLain,"Unlike lingerie that’s strictly for fantasy,
Look beneath at the Secrets.
Lace faces have Faux Vintage.
French lingerie that captures feminine.
Chic look and can also be worn all day.
Women who like to feel beautiful under their clothes.
You are the ultimate designers of these looks.
Tease him Nylon Stocking and have the exclusive.
Shapewear legs that go up to the clouds.
Waiting you will find these woman's his world.
Nylon stockings and matchless pantyhose.
Seamed Nylon Stockings.
Riding the elevator reinforced Heel and Toe.
Sheer to the Waist Panties.
Sheer Heel and Toe Nylon Stockings and high thighs.
In the Bra both twins he must carry.
Curvy Bras, stitch bullet bras, .
Push-up bras, strapless bras
and fish hooked long line bras with eyes coordinating.
Garter Belts and transparent girdles.
With a twist to his sleep.
Your salon Babydolls and shrimp and Robes.
Woman that will help him keep your romance alive!"
470,Emotion,RomancePoemsAnotherTeenRomancePoembyGabriellaFranco,"Uh oh! wakin' up from a dream
Wishin you were here with me
Jump up and down, now clap ya hands
One more teenage romance
Single? yeah, thats my thing
No commitment, no promise ring
Scream 'yeah' if ya understand
One more teenage romace
CHORUS:
Find myself waitin for your call
When i dont think of u i think of nothin at all
So if ya agree-scream shout and
Give it up for another teen romance
Oopsie daisy I'm lost in your eyes
For a moment you're the love of my life
Ever ended forever? lets see a show o' hands
One more teenage romance
1 week? 2 weeks? maybe a year?
How many temp. forevers we got in here?
Daddies an mommas got up n ran
Uh oh. Another teen romance"
471,Emotion,RomancePoemsByTheLakeSideRomanceOnAnIceBlockPoembysaadattahir,"As we stood by the lake side
An expanse so wide
For us to see
Then you and me
Our reflection in autumn tones
Bemoans
Belies
The placid waters hidden lies
The first chill of an errant breeze
I looked to the side rather than say please
As the sculpted flakes saunter down
Rest arrogantly on the parting geese's crown
The lumbering crane takes to air I behold
Portend the pervasive cold
Easy an slow practiced rise
Should have been no surprise
There was the swoon the croon
The fetching of a moon
The freezing lake holds my feet
Gingerly tread the storm an sleet
I Shudder I fear.
How shall I steer
My innocence naught in natures way
Or to have you sway
The lake is empty, staid.
Like the uselessness of my golden braid
We stand mute frozen in time
Until the inevitable rhyme
Weather the icy romance
To waltz and dance
I and the lake submit to natures will
To seek in time the thaw the thrill
(Islamabad)
(May 05,2009)"
472,Emotion,RomancePoemsRomanceOfDunoisPoembySirWalterScott,"It was Dunois, the young and brave, was bound for Palestine,
But first he made his orisons before Saint Mary's shrine:
'And grant, immortal Queen of Heaven,' was still the Soldierâ€™s prayer;
'That I may prove the bravest knight, and love the fairest fair.'
His oath of honour on the shrine he graved it with his sword,
And followed to the Holy Land the banner of his Lord;
Where, faithful to his noble vow, his war-cry filled the air,
'Be honoured aye the bravest knight, beloved the fairest fair.'
They owed the conquest to his arm, and then his Liegeâ€“Lord said,
'The heart that has for honour beat by bliss must be repaid.-â€”
My daughter Isabel and thou shall be a wedded pair,
For thou art bravest of the brave, she fairest of the fair.'
And then they bound the holy knot before Saint Mary's shrine,
That makes a paradise on earth, if hearts and hands combine;
And every lord and lady bright that were in chapel there
Cried, 'Honoured be the bravest knight, beloved the fairest fair!'"
473,Emotion,RomancePoems23RussianBrides19601RoundTheWorldRomancePoembyKarlStuartKline,"This I know... I have one!
She is very special
I think she’s beautiful
And so very unusual...
She is intelligent,
also very sensual,
Both of which are to me
Relationship essentials
What most brought her to me
Was her sweet empathy
Which I appreciate
Most since I lost Peggy
She’s not a replacement,
I love her for her Self
She’s what it took to get
This widower off the shelf
She’s my loved Marina
from her head to her feet
And she has what it takes
To make my life complete
She’s lovely and I say
She’s my Russian Treasure
Gold has value, but my
Lady’s beyond measure"
474,Emotion,RomancePoemshighSchoolRomanceJustATeenageGirlPoembyChristophersDead,"She wears a black bar over her eyes so you don't have to see her
Or at least she believes so if she can't see you
And her skin sticks to her clothing, pulsing sweat from the sunlight
If you get under that bar long enough you'll stick like glue
The accidental shirt slips down under the finer linen
Embarrassed that she has the shirt on in the first place
The finer things in life come free anyway, that's what she says
But she keeps that bar over her eyes, your mind starts to race
And when she smiles
And you're in denial
You can't help erase
What you know in the back of your mind she is
She's just a teenage girl, does she know any better?
Just a teenage girl, certainly her dad wouldn't let her
A teenage girl, and you wish you could have her
But I'm a teenage guy, and she's mine
Though I can't help wondering why she wants you
And I hope and pray that one day she'll look back at me
You know she likes you ‘cause your hands are so damn big
Well how the hell am I supposed to compete with that?
She wears a black bar over her eyes so you don't have to see her
Other censorship seems a waste when she gives it away
The finer things in life come free anyway, that's what you think
But I swear that I'll make you pay for taking her from me
And when she smiles
And you're in denial
You can't help erase
What you know in the back of your mind she is
She's just a teenage girl, does she know any better?
Just a teenage girl, certainly her dad wouldn't let her
A teenage girl, and now yeah you have her
And I'm just a teenage guy, she used to be mine."
475,Emotion,RomancePoemsGiveMeRomanceEverytimePoembyFionaDavidson,"Maybe a little romance is needed
Lightening our days in all this grey
To place a smile on our faces
You can't have too much romance
In a life that's filled with sadness
Making us laugh with pleasure
Give me romance to dazzle me
To make my heart sing out loud
And make me feel I'm alive
Bring on the romance to me
It's welcome in a soul of tears
Appreciated from this coldness
Give me romantic words and deeds
So pleasing to my eyes and ears
Make me happy for a little while
Give me romance everytime
To make me blush and smile
Instead of all these teasing words
rewrite of poem lost in the ether lol but still on document.....Fi"
476,Emotion,RomancePoemsTheRomanceOfTheKnightPoembyThomasChatterton,"The pleasing sweets of spring and summer past,
The falling leaf flies in the sultry blast,
The fields resign their spangling orbs of gold,
The wrinkled grass its silver joys unfold,
Mantling the spreading moor in heavenly white,
Meeting from every hill the ravished sight.
The yellow flag uprears its spotted head,
Hanging regardant o'er its watery bed;
The worthy knight ascends his foaming steed,
Of size uncommon, and no common breed.
His sword of giant make hangs from his belt,
Whose piercing edge his daring foes had felt.
To seek for glory and renown he goes
To scatter death among his trembling foes;
Unnerved by fear, they trembled at his stroke;
So cutting blasts shake the tall mountain oak.
Down in a dark and solitary vale,
Where the curst screech-owl sings her fatal tale,
Where copse and brambles interwoven lie,
Where trees intwining arch the azure sky,
Thither the fate-marked champion bent his way,
By purling streams to lose the heat of day;
A sudden cry assaults his listening ear,
His soul's too noble to admit of fear.-
The cry re-echoes; with his bounding steed
He gropes the way from whence the cries proceed.
The arching trees above obscured the light,
Here 'twas all evening, there eternal night.
And now the rustling leaves and strengthened cry
Bespeaks the cause of the confusion nigh;
Through the thick brake th'astonished champion sees
A weeping damsel bending on her knees:
A ruffian knight would force her to the ground,
But still some small resisting strength she found.
(Women and cats, if you compulsion use,
The pleasure which they die for will refuse.)
The champion thus: 'Desist, discourteous knight,
Why dost thou shamefully misuse thy might?'
With eye contemptuous thus the knight replies,
'Begone! whoever dares my fury dies!'
Down to the ground the champion's gauntlet flew,
'I dare thy fury, and I'll prove it too.'
Like two fierce mountain-boars enraged they fly,
The prancing steeds make Echo rend the sky,
Like a fierce tempest is the bloody fight,
Dead from his lofty steed falls the proud ruffian knight.
The victor, sadly pleased, accosts the dame,
'I will convey you hence to whence you came.'
With look of gratitude the fair replied-
'Content; I in your virtue may confide.
But,' said the fair, as mournful she surveyed
The breathless corse upon the meadow laid,
'May all thy sins from heaven forgiveness find!
May not thy body's crimes affect thy mind!'"
477,Emotion,RomancePoemsBoobyPrizeOrAFineRomance2PoembyDavidHarris,"Yesterday I wrote a joke poem,
Booby Prize Or A Fine Romance,
it told the story of how I met my wife,
all those years ago.
Yes, it was at her first husband’s funeral,
and yes a group of us
met a couple weeks later in a coffee bar,
but no it was not the drawing of a straw,
it was that I volunteered,
which I guess was lucky for me,
because on the 12th of September this year
we celebrate our 37th Wedding Anniversary.
Her first husband was a friend,
but he was a womaniser.
He met his dead in a suicide pact
with a fourteen-year-old girl.
He left a wife and two small children,
without a thought or care,
a month before Christmas that year.
Some said I was brave
to take on a ready-made family.
I do not think I was brave,
but very lucky that day.
We have had our ups and downs
like all families do,
but I would not change a bit of it.
The greatest gifts I received that day,
was a family for a lonely life,
and tolerance through trouble and strife.
Therefore, it is with thanks to them,
I am the man I am today."
478,Emotion,RomancePoemsAWomansLastSongFromAnUnpublishedRomancePoembyAlaricAlexanderWatts,"'Tis now that softening hour
When love hath deepest power,
To stir the fond heart with its dreams of delight;
When even the sickening thrill
Of hope deferred is still,
And the sunset of feeling grows golden and bright.
Oh believe me then in this,
Though, in moments of bliss,
Every pulse of thy heart found a response in mine;
When the storm upon us came,
I may merit thy blame,
But, so sweet was our sorrow, I could not repine.
Forgive me if I deemed
Fate kinder than it seemed,
If I smiled at the world and its wildest alarms;
If I inly blessed the grief
That bade thee seek relief
In the loving and cherishing pale of my arms.
Was loss of wealth severe
When a fond one was near
To soothe thee, and make thee a Crœsus in love?
Or vexations all must bear,
Worth a thought or a care,
Which a kiss, and thou'st owned it, a kiss could remove?
What are life's petty ills,
Its hectics or its chills,
Can they weaken affection or wither its flowers?
No; to hearts with feeling warm,
Love's the bow of the storm,
That grows broader and brighter the faster it showers.
Thus will it ever be,
On the world's troubled sea,
When two fond ones are cleaving in concert their way;
Though clouds sometimes may hide
Them, and tempests divide,
They'll be nearer than e'er when the rack drives away.
In life's genial spring,
As on Pleasure's light wing
Through her bowers of enchantment we joyously roved;
With feelings, hopes and fears,
Far too deep for our years,
In that spring-burst of sunshine we met and we loved!
Thou wert then of an age
When the stormy passions rage
More wildly the harsher earth's wise ones reprove;
Pride and gentleness combined,
In thy deep heart were shrined;
The softness and fire of the eagle and dove!
Though Fortune was unkind,
To thy merits ever blind,
Still thy soul could unstooping her malice endure;
And what though thou wert thrown
On this wide world alone,
Did I love thee the less for being friendless and poor?
What is wealth, what is wealth,
Could it purchase me health,
Or secure for us moments more blissful than those
We together oft have passed,
When even Fate's chilling blast
Could not ruffle our own little heaven of repose!
Surely not, surely not;
Every grief was forgot,
Whilst enfolded by thee on thy bosom I hung;
And though tempests raged above,
They were harmless to love,
For the wilder the ruin the closer we clung.
But the sun has looked his last,
And the day is fading fast,
And night's shades are o'erwhelming my heart and my song;
Fare thee well, a long farewell;
I have broken the spell
That has bound me to earth and its witcheries too long!"
479,Emotion,RomancePoemsMayDecemberRomancePoembyJuanOlivarez,"She is May,
And I am December.
She appeared one day,
And she fanned the embers.
She is morning,
And I am twilight.
She's just started soaring,
And I'm scared of heights.
She is so fresh,
Like the morning dew.
I'm an old geyser
That no longer spews.
I guess I'm as lucky,
As lucky can be.
Because with so many young bucks,
She decided on me.
10/6/10 Alton Texas"
480,Emotion,RomancePoemsRomancePoembyCPSharma,"the bud firmly holds
the ecstasy of the kiss,
in fast bloom
it doesn’t want to miss.
but in the bloom
hug-warmth’s
new heights are told,
bliss within
to the world is unfold.
the Nature is filled
with romance all around,
the parallel of its blissful romance
is nowhere found."
481,Emotion,RomancePoemsBlackRoseRomancePoembyAngelRoseRomance,"Love is pain
So scars remain
Mind and body,
It's all the same
I love you now
Like I loved you then
Why do we have to just stay friends?
Is this just my fantasy
because you act like we were never meant
to be
I send you roses, they're usually white
But now that I have changed my mind,
They are blood red
You ask me why and I say
because my wrists bleed for you in the night
I sit alone in my room, listening to the music
That we used to
Then I slowly start to notice that everything
We had has come to an end
Right now I'm hurt and you don't
understand
So let go of my hand
At least until you understand
: : ..**xx Black ROSE Romance xx**..: :"
