,topic,file,text
653,Emotion,GirlPoemsTheBushGirlPoembyHenryLawson,"So you rode from the range where your brothers “select,”
Through the ghostly grey bush in the dawn---
You rode slowly at first, lest her heart should suspect
That you were glad to be gone;
You had scarcely the courage to glance back at her
By the homestead receding from view,
And you breathed with relief as you rounded the spur,
For the world was a wide world to you.
Grey eyes that grow sadder than sunset or rain,
Fond heart that is ever more true
Firm faith that grows firmer for watching in vain---
She’ll wait by the sliprails for you.
Ah! The world is a new and a wide one to you,
But the world to your sweetheart is shut,
For a change never comes to the lonely Bush girl
From the stockyard, the bush, and the hut;
And the only relief from the dullness she feels
Is when ridges grow softened and dim,
And away in the dusk to the sliprails she steals
To dream of past meetings “with him.”
Do you think, where, in place of bare fences, dry creeks,
Clear streams and green hedges are seen---
Where the girls have the lily and rose in their cheeks,
And the grass in midsummer is green---
Do you think now and then, now or then, in the whirl
Of the city, while London is new,
Of the hut in the Bush, and the freckled-faced girl
Who is eating her heart out for you?
Grey eyes that are sadder than sunset or rain,
Bruised heart that is ever more true,
Fond faith that is firmer for trusting in vain---
She waits by the sliprails for you"
654,Emotion,GirlPoemsWhereDoYouGoGirlPoembyMichaelShepherd,"Where do you go, girl,
when you fall asleep?
for even when we've spent a passion's time,
you, all woman and all animal,
and then drift gently into sleep
and I to watch you drift -
you're straight away a girl again.
Do you dream a girlhood's dearest dreams?
or roam a woman's world?
What girlhood's safe, safe place
do you retreat to
in your private sleep?
Was it when the only man to love
was your beloved father,
still recovering from a wartime's hangover
with alcohol - and your so fierce, despairing help?
Where do you go in sleep?
while I now watch  this unknown girl;
an upper lip that asks so innocently
to be kissed?
And lower lip that just so innocently
enjoys?
Where do you go, girl,
so far, so many years away from me?
Where do you go, girl?"
655,Emotion,GirlPoemsAnEnglishGirlPoembyWilliamSchwenckGilbert,"A wonderful joy our eyes to bless,
In her magnificent comeliness,
Is an English girl of eleven stone two,
And five foot ten in her dancing shoe!
She follows the hounds, and on she pounds -
The ""field"" tails off and the muffs diminish -
Over the hedges and brooks she bounds -
Straight as a crow, from find to finish.
At cricket, her kin will lose or win -
She and her maids, on grass and clover,
Eleven maids out - eleven maids in -
(And perhaps an occasional ""maiden over"").
Go search the world and search the sea,
Then come you home and sing with me
There's no such gold and no such pearl
As a bright and beautiful English girl!
With a ten-mile spin she stretches her limbs,
She golfs, she punts, she rows, she swims -
She plays, she sings, she dances, too,
From ten or eleven till all is blue!
At ball or drum, till small hours come
(Chaperon's fan conceals her yawning),
She'll waltz away like a teetotum,
And never go home till daylight's dawning.
Lawn tennis may share her favours fair -
Her eyes a-dance and her cheeks a-glowing -
Down comes her hair, but what does she care?
It's all her own and it's worth the showing!
Go search the world and search the sea,
Then come you home and sing with me
There's no such gold and no such pearl
As a bright and beautiful English girl!
Her soul is sweet as the ocean air,
For prudery knows no haven there;
To find mock-modesty, please apply
To the conscious blush and the downcast eye.
Rich in the things contentment brings,
In every pure enjoyment wealthy,
Blithe as a beautiful bird she sings,
For body and mind are hale and healthy.
Her eyes they thrill with right goodwill -
Her heart is light as a floating feather -
As pure and bright as the mountain rill
That leaps and laughs in the Highland heather!
Go search the world and search the sea,
Then come you home and sing with me
There's no such gold and no such pearl
As a bright and beautiful English girl!"
656,Emotion,GirlPoemsDaddysGirlPoembyAngieWatson,"As the young woman remembers her childhood
She begins to cry,
Remembering how much she loved her father.
Just thinking how he'd left her so soon
Breaks her heart in two.
She remembered when she was a little child:
A curly haired little girl
Attached to her daddy's leg.
The way she'd hide behind her daddy
When people spoke to her.
She remembered how he'd loved her
And wondered if he knew she loved him too.
She remembered how she'd cried that night
At the hospital
When the thought of never getting to see her daddy again
Had crossed her mind.
She remembered how everything she'd done
Was so sweet to him.
She remembered the times she'd never let go
Of the belt loops of his pants.
She remembered how he loved her so
And how she'd never be able to stay angry with him.
But the girl will never forget
That her daddy will be in her heart always
And she will always be
Daddy's little girl."
657,Emotion,GirlPoemsABrownGirlDeadPoembyCounteeCullen,"With two white roses on her breasts,
White candles at head and feet,
Dark Madonna of the grave she rests;
Lord Death has found her sweet.
Her mother pawned her wedding ring
To lay her out in white;
She'd be so proud she'd dance and sing
to see herself tonight."
658,Emotion,GirlPoemsNoOneUnderstandsHeartacheLikeABeautifulGirlPoembyMeaganPeters,"In a world of barbies, implants and a size 26 waist
heartache's no more prevalent than in her with a beautiful face.
No more wanted for her looks than her heart
her persona fades as soon as puberty starts.
She screams celebrity in a small town manner
In a world that passes judgement by how much you achieve
she must use her 'talents' as the world perceives.
As years go by her beauty's but a nuisance
to the person inside made up of more substance.
She SCREAMS celebrity in a small town manner
There's no plastic surgery to alter your soul
no place for outward beauty in the world of good will.
To wed true love's but a leap of trust
so she squanders her beauty as a matter of must.
For small town love in true Hollywood fashion."
659,Emotion,GirlPoemsTheBlindGirlPoembyWilliamTopazMcGonagall,"Kind Christians, pray list to me,
And I'll relate a sad story,
Concerning a little blind girl, only nine years of age,
Who lived with her father in a lonely cottage.
Poor girl, she had never seen the blessed light of day,
Nor the beautiful fields of corn and hay,
Nor the sparrows, that lifted their heads at early morn
To bright Sol that does the hills adorn.
And near the cottage door there was an elm tree;
But that stunted elm tree she never did see,
Yet her little heart sometimes felt gay
As she listened to the thrushes that warbled the live-long day.
And she would talk to the wren when alone,
And to the wren she would her loneliness bemoan,
And say, ""Dear little wren, come again to-morrow;
Now be sure and come, your singing will chase away my sorrow.""
She was motherless, but she had a drunken father,
Who in his savage moods drank all he could gather,
And would often cruelly beat her until she would cry,
""Dear father, if you beat me I will surely die.""
She spent the days in getting ready her father's food,
Which was truly for her drunken father's good;
But one night he came home, reeling drunk,
And the poor child's heart with fear sunk;
And he cried, ""You were at the door when I came up the lane;
Take that, you good-for-nothing slut; you're to blame
For not having my supper ready; you will find
That's no excuse, Sarah, because you are blind.""
And with a stick he struck her as he spoke
Across the shoulders, until the stick almost broke;
Crying aloud, ""I'll teach you better, you little sneak;""
And with the beating, Sarah's heart was like to break.
Poor little Sarah had never seen the snow;
She knew it was beautiful white, some children told her so;
And in December, when the snow began to fall,
She would go to the door and make a snowball.
One day she'd been very cheerless and alone,
Poor child, and so cold, almost chilled to the bone;
For her father had spent his wages in drink,
And for want of fire she was almost at death's brink.
Her face was pinched with hunger but she never complained,
And her little feet with cold were chilblained,
And her father that day had not come home for dinner,
And the dull grey sky was all of a shimmer.
So poor Sarah was very sick when her father came home;
So bad, little dear, that she did sigh and moan,
And when her father saw her in bed
He was heart-stricken with fear and dread.
So within a few days poor Sarah did die,
And for the loss of Sarah the drunken father did cry,
So the loss of his child soon converted him
From drinking either whiskey, rum or gin."
660,Emotion,GirlPoemsTheLittleMatchGirlPoembyWilliamTopazMcGonagall,"It was biting cold, and the falling snow,
Which filled a poor little match girl's heart with woe,
Who was bareheaded and barefooted, as she went along the street,
Crying, ""Who'll buy my matches? for I want pennies to buy some meat!""
When she left home she had slippers on;
But, alas! poor child, now they were gone.
For she lost both of them while hurrying across the street,
Out of the way of two carriages which were near by her feet.
So the little girl went on, while the snow fell thick and fast;
And the child's heart felt cold and downcast,
For nobody had bought any matchea that day,
Which filled her little mind with grief and dismay.
Alas! she was hungry and shivering with cold;
So in a corner between two houses she made bold
To take shelter from the violent storm.
Poor little waif! wishing to herself she'd never been born.
And she grew colder and colder, and feared to go home
For fear of her father beating her; and she felt woe-begone
Because she could carry home no pennies to buy bread,
And to go home without pennies she was in dread.
The large flakes of snow covered her ringlets of fair hair;
While the passers-by for her had no care,
As they hurried along to their homes at a quick pace,
While the cold wind blew in the match girl's face.
As night wore on her hands were numb with cold,
And no longer her strength could her uphold,
When an idea into her little head came:
She'd strike a match and warm her hands at the flame.
And she lighted the match, and it burned brightly,
And it helped to fill her heart with glee;
And she thought she was sitting at a stove very grand;
But, alas! she was found dead, with a match in her hand!
Her body was found half-covered with snow,
And as the people gazed thereon their hearts were full of woe;
And many present let fall a burning tear
Because she was found dead on the last night of the year,
In that mighty city of London, wherein is plenty of gold -
But, alas! their charity towards street waifs is rather cold.
But I hope the match girl's in Heaven, beside her Saviour dear,
A bright reward for all the hardships she suffered here."
661,Emotion,GirlPoemsAboutTheLittleGirlThatBeatHerSisterPoembyAnnTaylor,"Go, go, my naughty girl, and kiss
Your little sister dear;
I must not have such things as this,
And noisy quarrels here.
What! little children scratch and fight,
That ought to be so mild;
Oh! Mary, it's a shocking sight
To see an angry child.
I can't imagine, for my part,
The reason for your folly;
She did not do you any hurt
By playing with your dolly.
See, see, the little tears that run
Fast from her watery eye:
Come, my sweet innocent, have done,
'Twill do no good to cry.
Go, Mary, wipe her tears away,
And make it up with kisses:
And never turn a pretty play
To such a pet as this is."
662,Emotion,GirlPoemsYouWereNeverALittleGirlPoembyUriahHamilton,"Your world is fragile glass
Every day breaking like bones
Against the heartless pavement
Of this dingy city where dreams disappear
In the blink of an eye
Like a thousand species
Growing extinct
In the dying rainforest.
Divorce and disintegrating family life
Stole from you a happy childhood
With the malicious hands
Of a marauding thief,
You were never a little girl.
Next time I see you
Stranded on some dirty street
In the hopeless dawn
With no fuel in your tank
To get back home,
Take my twenty free,
I won’t bother you for sex."
663,Emotion,GirlPoemsToAHighlandGirlAtInversneydeUponLochLomondPoembyWilliamWordsworth,".   Sweet Highland Girl, a very shower
Of beauty is thy earthly dower!
Twice seven consenting years have shed
Their utmost bounty on thy head:
And these grey rocks; that household lawn;
Those trees, a veil just half withdrawn;
This fall of water that doth make
A murmur near the silent lake;
This little bay; a quiet road
That holds in shelter thy Abode--
In truth together do ye seem
Like something fashioned in a dream;
Such Forms as from their covert peep
When earthly cares are laid asleep!
But, O fair Creature! in the light
Of common day, so heavenly bright,
I bless Thee, Vision as thou art,
I bless thee with a human heart;
God shield thee to thy latest years!
Thee, neither know I, nor thy peers;
And yet my eyes are filled with tears.
With earnest feeling I shall pray
For thee when I am far away:
For never saw I mien, or face,
In which more plainly I could trace
Benignity and home-bred sense
Ripening in perfect innocence.
Here scattered, like a random seed,
Remote from men, Thou dost not need
The embarrassed look of shy distress,
And maidenly shamefacedness:
Thou wear'st upon thy forehead clear
The freedom of a Mountaineer:
A face with gladness overspread!
Soft smiles, by human kindness bred!
And seemliness complete, that sways
Thy courtesies, about thee plays;
With no restraint, but such as springs
From quick and eager visitings
Of thoughts that lie beyond the reach
Of thy few words of English speech:
A bondage sweetly brooked, a strife
That gives thy gestures grace and life!
So have I, not unmoved in mind,
Seen birds of tempest-loving kind--
Thus beating up against the wind.
What hand but would a garland cull
For thee who art so beautiful?
O happy pleasure! here to dwell
Beside thee in some heathy dell;
Adopt your homely ways, and dress,
A Shepherd, thou a Shepherdess!
But I could frame a wish for thee
More like a grave reality:
Thou art to me but as a wave
Of the wild sea; and I would have
Some claim upon thee, if I could,
Though but of common neighbourhood.
What joy to hear thee, and to see!
Thy elder Brother I would be,
Thy Father--anything to thee!
Now thanks to Heaven! that of its grace
Hath led me to this lonely place.
Joy have I had; and going hence
I bear away my recompense.
In spots like these it is we prize
Our Memory, feel that she hath eyes:
Then, why should I be loth to stir?
I feel this place was made for her;
To give new pleasure like the past,
Continued long as life shall last.
Nor am I loth, though pleased at heart,
Sweet Highland Girl! from thee to part;
For I, methinks, till I grow old,
As fair before me shall behold,
As I do now, the cabin small,
The lake, the bay, the waterfall;
And thee, the spirit of them all!"
664,Emotion,GirlPoemsPeaceLittleGirlPeacePoembyMiaOcean,"The poor young girl
with beach blonde hair
and pale white skin
stands in the middle of the street,
in the middle of a war.
Her face shows pain,
her face shows she wants help.
She goes to the hardware store
and steals a can of purple paint.
She doesn't know better,
so it doesn't matter.
The pale girl opens the can of purple paint
and uses her hands to write a message on the
big brick building wall.
She uses what knowledge she has of spelling,
and traces her purple paint covered fingers
over the wall.
First she draws a P
than an E
than she dips her hand back in the paint.
When she is done with the word,
the purple paint has run down the wall,
but you could still see the word very clearly.
It spelled PEACE.
The young girl takes her hand and presses it to the wall
leaving a very small purple handprint.
Then she runs.
A soldier calls after her,
'Peace little girl, Peace! '"
665,Emotion,GirlPoemsWorldWearyGirlPoembyUriahHamilton,"World-weary girl,
Tears form in your eyes,
Confusion swirls
Like a virulent tornado
Around your heart,
Rending the fragile fabric of your soul,
I fear, irreparably apart.
I want to kiss your delicate face,
Gently touch your hair,
Reassure you I’m on your side,
Reassure you that I care.
World-weary girl,
Invite me into your life,
Help me understand your story
If we have to talk unceasingly
Through the dark and lonely night.
I believe in your struggle,
And I’ll send sympathetic prayers into the universe
Until I know the dawn of a new embrace
Has brought you into the arms
Of an indisputable and transforming love."
666,Emotion,GirlPoemsGirlInLovePoembyRainerMariaRilke,"That's my window. This minute
So gently did I alight
From sleep--was still floating in it.
Where has my life its limit
And where begins the night?
I could fancy all things around me
Were nothing but I as yet;
Like a crystal's depth, profoundly
Mute, translucent, unlit.
I have space to spare inside me
For the stars, too: so full of room
Feels my heart; so lightly
Would it let go of him, whom
For all I know I have started
To love, it may be to hold.
Strange, as if never charted,
Stares my fortune untold.
Why is it I am bedded
Beneath this infinitude,
Fragrant like a meadow,
Hither and thither moved,
Calling out, yet fearing
Someone might hear the cry,
Destined to disappearing
Within another I."
667,Emotion,GirlPoemsJustALittleGirlPoembyLovinaSylviaChidi,"You subjected her to a night of hell
Hey! Did you know?
She was just a little girl
You took her to a run down motel
Hey! Did you know?
She was just a little girl
Now you hold her crying soul to sell
Hey! Did you know?
She was just a little girl
When you forced her out of her shell
Hey! Did you know?
She was just a little girl
Couldn’t you tell by her face?
She had the smile of an angel
A virgin waiting for wedding bells
Hey! Did you know?
You are not well?
The only place you belong is a cell
With horrifying smells!
Hey! Did you know?
She is no more a little girl, they yell
Copyright 2006 - Sylvia Chidi"
668,Emotion,GirlPoemsCombatReadyGirlPoembyUriahHamilton,"I need a combat-ready girl
Who knows that the world
Is callous and cold,
Waiting to cut you down
Before giving you a chance
Or letting you dance.
She needs to be
A solitude queen,
Close friends
With loneliness
But with inner perseverance.
I want to defend someone
And be defended
From the raging stupidity
And insensitivity
Of heartless society!
True love
Is the unity
Of emotional soldiers,
Fighting for kisses,
Fighting for closeness,
Fighting for trust,
Fighting against all the odds
While sharing embraces
In the march
Toward eternity.
I need this unbreakable bond
Because lonely tears
Have the power
Of decimating bombs,
And one weary soldier
Will not survive
Those bombs alone."
669,Emotion,GirlPoemsIStillSeeThatGirlPoembyMaryNagy,"I see the girl of innocence
that you at one time were.
You have to take your life back.
You owe that much to her.
She needs you to unclutter
the hurt you've filed away.
The memories of tragedy
and the things you never say.
If your heart is filled with sadness
where's the room for happiness?
That girl deserves attention
and she'll stand for nothing less!
Your soul is not a graveyard
for you to bury all your pain.
You can't hold in the feelings
that are driving you insane.
Purge your hate and anger.
Pour your darkness out.
Let your pain be recognized.
Hollar, scream, and shout!
No matter what it takes
just let her feel she's loved.
Don't allow her to be beaten,
abused....pushed and shoved.
That girl I know is hurting.
That girl deserves the best.
Make ''you'' a priority
and you will pass His test.
**For my sister Danielle.  I still see that innocent girl from our childhood.  I hope you see her too.  Love, Mary"
670,Emotion,GirlPoemsACowherdingGirlPoembyMirabai,"The plums tasted
sweet to the unlettered desert-tribe girl-
but what manners! To chew into each! She was ungainly,
low-caste, ill mannered and dirty,
but the god took the
fruit she'd been sucking.
Why? She'd knew how to love.
She might not distinquish
splendor from filth
but she'd tasted the nectar of passion.
Might not know any Veda,
but a chariot swept her away-
now she frolics in heaven, esctatically bound
to her god.
The Lord of Fallen Fools, says Mira,
will save anyone
who can practice rapture like that-
I myself in a previous birth
was a cowherding girl
at Gokul."
671,Emotion,GirlPoemsIWasThatGirlPoembyMaryNagy,"I was that girl...in the shadows
of an ever-dying love.
I was that girl...searching for God
just begging for help from above.
I was that girl...in the darkness
trying to find my way.
I was that girl...raised in violence
and then selfishly thrown away.
I was that girl...full of anger
for the past and all of the pain.
I was that girl....but now I'm not
and I'll never be her again."
672,Emotion,GirlPoemsThisGirlPoembyJulieBond,"This Girl In The Dark
Has a beautiful face without a name
And a beautiful smile to hide the pain
This Girl In the Dark
Has cuts up her arm
Loves nothing more then self harm
This Girl in the dark
Doesn’t know how much longer she can keep trying
Everyday she’s slowly dying
This Girl in the Dark
Sits all alone
Wants a place to truly call home
This Girl in the dark
Wants nothing more then to be free
I know this because this Girl is me"
673,Emotion,GirlPoemsServantGirlAndGrocersBoyPoembyJoyceKilmer,"Her lips' remark was: ""Oh, you kid!""
Her soul spoke thus (I know it did):
""O king of realms of endless joy,
My own, my golden grocer's boy,
I am a princess forced to dwell
Within a lonely kitchen cell,
While you go dashing through the land
With loveliness on every hand.
Your whistle strikes my eager ears
Like music of the choiring spheres.
The mighty earth grows faint and reels
Beneath your thundering wagon wheels.
How keenly, perilously sweet
To cling upon that swaying seat!
How happy she who by your side
May share the splendors of that ride!
Ah, if you will not take my hand
And bear me off across the land,
Then, traveller from Arcady,
Remain awhile and comfort me.
What other maiden can you find
So young and delicate and kind?""
Her lips' remark was: ""Oh, you kid!""
Her soul spoke thus (I know it did)."
674,Emotion,GirlPoemsSweetCountryGirlAndIPoembyPaultheLion,"My eyes first caught her across the street
She looked like someone I'd fancy to meet
She was wearing a long violet dress
But I was rugged and my hair was a mess
You were wondering who was this cat
Sitting on a rotten bench in a dirty cowboy hat
On his guitar he was trying to play some John Denver song
You laughed because half of his chords were wrong
She walked up and asked if I wanted a cuppa joe
I boyishly smiled and said 'I reckon so'
I strolled down the dirt road with this girl in a pretty gown
She said there wasn't a single paved street in town
At the restaurant he informed you that he was from Amarillo
Where the cops are awful and the democrats are yellow
You smiled and said 'tha pigs are worse here, I'll bet ya'
You nonetheless added 'welcome to Georgia'
I grinned as I stuck a Marlboro in my mouth
And told her it was my sixth trip down south
I said I enjoyed rural towns in this part of the States
Where life is simple with no technological updates
You somberly said you no longer find this place desirous
For the city of Atlanta is spreading like a virus
You said your days are full of concern and strife
For Atlanta's threatening your way of life
After coffee we took a long walk in the park
It was peaceful, there were no dogs there to bark
I told her I though she was very pretty
And apologized that I was so dirty
You bashfully accepted the compliments from this young man
And said 'well ah tra to make masef as beautiful as ah can'
Then he kissed you, which was a bit of a surprise
But you didn't mind as you closed your eyes
I felt kinda guilty for kissing her quickly without reason
So I told her she was obviously very smart and a good person
I said she was much nicer than city slicking bitches
Who are materialistic, dishonest and untrustworthy snitches
You looked into his weather hardened yet pretty face
And offered to take you both back to your place
He lowered his head and shyly agreed
You were glad you didn't have to plead
I awoke before her
With my mind a blur
But I hurriedly left a note saying I must catch a Greyhound
For it was San Francisco where I was bound
You woke up with an empty stare
For he was not there
You probably thought to him it was just a game
And that all men are the same"
675,Emotion,GirlPoemsSongOfTheLittleWhiteGirlPoembyKatherineMansfield,"Cabbage tree, cabbage tree, what is the matter?
Why are you shaking so?  Why do you chatter?
Because it is just a white baby you see,
And it's the black ones you like, cabbage tree?
Cabbage tree, cabbage tree, you're a strange fellow
With your green hair and your legs browny-yellow.
Wouldn't you like to have curls, dear, like me?
What!  No one to make them?  O poor cabbage tree!
Never mind, cabbage tree, when I am taller,
And if you grow, please, a little bit smaller,
I shall be able by that time, bay be,
To make you the loveliest curls, cabbage tree."
676,Emotion,GirlPoemsAGirlPoembyEzraPound,"The tree has entered my hands,
The sap has ascended my arms,
The tree has grown in my breast -
Downward,
The branches grow out of me, like arms.
Tree you are,
Moss you are,
You are violets with wind above them.
A child - so high - you are,
And all this is folly to the world."
677,Emotion,GirlPoemsQuietGirlPoembyLangstonHughes,"I would liken you
To a night without stars
Were it not for your eyes.
I would liken you
To a sleep without dreams
Were it not for your songs."
