,topic,file,text
263,Emotion,KissPoemsKissByKissPoembyJamesMcLain,"The woman full.
The sun it burns.
The earth when wet which scented smells.
Between the collums,
where you stood, I am.
Rising from the mud.
The squelch of sound is of.
The seaweed it is dark it grasps my feet.
Released divine all knowledge,
of some lighter secret?
Pulsing, pulsed it's forced, as it pours out.
Do you as other people touch that feeling?
What kind of sight, first night?
The love of wind is travelling through the air,
and the northern star,
the rainstorm, where the water it is sharp.
Two bodies which become.
Each depending on the others single sweetness.
Kissing you, I kiss the sky,
and by your kiss, I slip once more into the night."
264,Emotion,KissPoemskissKissAndKissPoembyDwiutami,"Kiss kiss kiss me again*
Afterwards kiss kiss kiss my thoughts*
Then kiss kiss kiss my spirit*
Still kiss kiss kiss my shadow*
Don't forget to kiss kiss kiss my hair*
Repeated again kiss kiss kiss my face*
I'wanted to be kiss kiss kiss by you my brow*
Don't forget to kiss kiss kiss my cheek*
Afterwards kiss kiss kiss ears and my nose*
I'will like if being kiss kiss kiss by you my heart*
More kiss kiss kiss my lips*
Don't forget kiss kiss kiss with the love*
Repeated still kiss kiss kiss in the hope that we *
I'wanted to be kiss kiss kiss by you before i'slept*
I'hoped was kiss kiss kiss by you when i'opened the eyes and got up from my dream*
I'will like if being kiss kiss kiss by you my wish*
Don't forget kiss kiss kiss with your loyalty*
Kiss kiss kiss was our prayer together in the love*
G(-_-) (-_-) D"
265,Emotion,KissPoemsYourKissPoembyAmandaBristow,"I  can feel your magical touch,
when you kiss me,
I can feel your kiss,
With every bliss,
When you kissed me that afternoon,
I knew you were the one,
Your kiss, made everything right,
Although it scared me a tone,
Your kiss, swept me away,
Like a big powerful wave,
Your kiss, made my day,
I could feel you in every way,
Your kiss, was longed for,
It made me nervous,
Your kiss, lingered within,
It moved me,
Your kiss, remained in my thoughts,
Leaving me wanting more,
Your kiss, consumed me,
In one single moment."
266,Emotion,KissPoemsAKissKissKissPoembyMAsimNehal,"How naïve these mountains are
They are trying to kiss the sky
And feel that the clouds are a hindrance
Every time they make them fall on earth
Something grows and wishes are born
Now these mountains plea
O Sky bow down little and reach me
I want to kiss you like ~
The moonbeams kiss the sea
The bees kiss the flowers
And the waves kiss the shore."
267,Emotion,KissPoemsTheKissPoembyEdithNesbit,"The snow is white on wood and wold,
The wind is in the firs,
So dead my heart is with the cold,
No pulse within it stirs,
Even to see your face, my dear,
Your face that was my sun;
There is no spring this bitter year,
And summer's dreams are done.
The snakes that lie about my heart
Are in their wintry sleep;
Their fangs no more deal sting and smart,
No more they curl and creep.
Love with the summer ceased to be;
The frost is firm and fast.
God keep the summer far from me,
And let the snakes' sleep last!
Touch of your hand could not suffice
To waken them once more;
Nor could the sunshine of your eyes
A ruined spring restore.
But ah-your lips! You know the rest:
The snows are summer rain,
My eyes are wet, and in my breast
The snakes' fangs meet again."
268,Emotion,KissPoemsTheFirstKissPoembyNormanRowlandGale,"On Helen’s heart the day were night!
But I may not adventure there:
Here breast is guarded by a right,
And she is true as fair.
And though in happy days her eyes
The glow within mine own could please,
She’s purer than the babe who cries
For empire on her knees.
Her love is for her lord and child,
And unto them belongs her snow;
But none can rob me of her wild
Young kiss of long ago!"
269,Emotion,KissPoemsTheFirstLuckyBoyToKissYourVirginBreastsPoembyUriahHamilton,"Woman, you are the one who lingers
In my mind with aching tenderness,
But you are hidden in the distance,
Walking through the business world
With your stately shoulders
In a summer dress;
Your smile is brief and suggests
Inner-stirring ideas
For the moment suppressed.
Are your thoughts
All professional and money related?
Or do you drift
Into your young girl affairs
And the first lucky boy
To kiss your virgin breasts?
I would have been
That fortunate and karma-blessed boy
If circumstance and geography
Would have brought me
To the wondrous parks and haunts
Of your girlhood dreams.
It would have been love
And I wouldn’t have lost you
To indelicate or cruel mistakes of time,
I would have cherished your breath
And would have kept you
Like a mystical and sacred locket
Forever next to my heart."
270,Emotion,KissPoemsTheKissPoembyArmourQuillHunter,"What's in a kiss; how many there-be...?
'So many, it boggles the mind's reality…'
A kiss can be a greeting- “of body and soul-! '
It's an unspoken language, telling more than “what's told.”
It is sometimes “a spark-, ” to light one's flame…
Or often “self-flattery” to play one's game.
There's the 'kiss of friendship-, '
The 'kiss of guile…, '
The 'kiss of SINCERITY, '
The 'kiss of style…, '
There's the 'kiss of Life” and the 'kiss of Death! '
There's the 'kiss that steals one's breath away…”
And one “that prays it will last all day! ”
There's the 'kiss that frees the soul…'
Also one that 'detours from one's goal…! '
There's the kiss of a parent, the “kiss of a child…, ”
The “kiss of curiosity- running wild…! ”
The kiss of respect; and a kiss of shame…,
A kiss of honor- and “a kiss to tame…! ”
There's a kiss of the reserved-, “perceived amorous- (the same): ”
A kiss of 'the insecure-, ' to win their ball game!
There's a 'kiss of the stagnant; ' the 'kiss of the free…! ”
Also a 'kiss of those secure-, ” as the best there can be…
Yet what's in a kiss-, that's the question still…?
Maybe, it's how we perceive it to be-,
A reflection of “our state-of-mind…! ”
But; there's the kiss of harmony…
A kiss that divides…
A kiss that is honest…
And a kiss that hides….
There's a kiss of the clever…
A kiss of the mundane…
There's “a kiss like a symphony-, ” with rapturous refrain…!
There’s a plane where “Mercy and Truth meet intimately in bliss; ”
In the plumbline-address, where “Righteousness and Peace kiss! ”
Yet 'still-in-all-, ' maybe the question should be-,
Not 'what's in a kiss” but “what’s in the Kisser, ' you see…"
271,Emotion,KissPoemsFirstKissLastKissPoembySusanAsh,"The warmth of his body
Flows through his touch,
Enfolding me in his universe.
I look deep
To catch a glimpse
Of his soul.
Feels he has already
Seen and taken
Possession of mine.
I drink in his breath,
A sweet nectar
Invading my body.
Melt in to him,
Eager surrender …….
Then disappointment.
They couldn’t
Match my ardour,
Didn’t understand it.
Wished I had
Feigned reluctance,
Been my seducers,
Felt special,
The conquerors.
He doesn’t know!
He was special.
Did seduce me,
Conquer me
Long ago ……
The first time
He looked
Into my eyes.
No forgiveness.
Aware of disapproval,
My passion rejected,
The moment is lost.
Already history."
272,Emotion,KissPoemsKissMeAgainLikeWetDogsPoembyUriahHamilton,"I love you in the rain
Walking lonely along the boulevard
Gazing at all the passing cars;
The glimmer of neon signs
Flash like batting eyes from drugstores.
Neither of us were ever concerned with crime,
Our thoughts were bathed in the sublime
As we made our way down dirty streets,
Somehow a paradise for the lost;
Kiss me again like wet dogs
Straying without hope
Blindly into the night.
You know my addiction for extinction
And everyway I tried to die;
We dug Kierkegaard as well as the philosophy
Of non-judgment and non-injury;
And the poetry of romantic defeat
Was oozing from my pores like sweat
And I was glad you were next to me
To relish the journey of splintered thoughts
Blooming into a bouquet of dangerous dreams."
273,Emotion,KissPoemsKissOfAnAngelPoembykellyberry,"They were a soft kiss that he felt on his lips.
The kiss was gentle and made him fell warm.
The kiss made him fell safe and secure.
Just for the special seconds he had her in his arms.
Even then this angel who kiss him disappeared.
He knows that deep in his heart.
He had a kiss of an angel in his heart."
274,Emotion,KissPoemsTheThingsIDoWithLipsOrIWillKissYouPoembyEilaMahimaJaipaul,"I will kiss you
good night
good morning
good day
when you open your eyes
when you close them again
I will kiss you
lips exploring textures untested
new tastes, new temptation
probing, delicious and sweet
dancing, delighting
teasing
I will kiss you
as you feast upon my love
as you consume my body
let me fill you with my joy
then,
I will kiss you again."
275,Emotion,KissPoemsToAKissPoembyRobertBurns,"Humid seal of soft affections,
Tend'rest pledge of future bliss,
Dearest tie of young connections,
Love's first snow-drop, virgin kiss.
Speaking silence, dumb confession,
Passion's birth, and infants' play,
Dove-like fondness, chaste concession,
Glowing dawn of brighter day.
Sorrowing joy, adieu's last action,
Ling'ring lips, -- no more to join!
What words can ever speak affection
Thrilling and sincere as thine!"
276,Emotion,KissPoemsKissMeSlowlyPoembyLovinaSylviaChidi,"Kissing is an art, one most master
Kissing slowly is better than faster
Kiss me slowly
Kiss me tenderly
Kiss me sweetly
Kiss me on the lips
Down to my finger tips
Delicately sample my nipples
Kiss it, tease it, rather simple
When done right, let me be precise
Kissing itself can be rather very nice
Kiss me slowly
Kiss me tenderly
Kiss me sweetly
Kiss my body inch by inch
Till it tickles and starts to flinch
Kiss me in the left and right ear
Whisper sweet words of passionate care
Kiss me by the neck
With little kisses called pecks
Kiss me hungrily in the mouth
Hear my groaning delicious shouts
Kiss me below and yonder
Till my juices begin to ponder
And turn on fire with desire
Kiss me slowly
Kiss me tenderly
Kiss me sweetly
Kiss me once, twice, thrice
Oooo! These kisses are very nice
Copyright 2006 - Sylvia Chidi"
277,Emotion,KissPoemsAKissPoembyAnnaCellmer,"I run through the rainbow
Drenching my mouth
In the pastels - tints
Of its passing,
Absorbing every touch of its colour
This warmth I love,
It pulsates in blood,
And I penetrate
Across its variety,
Pages of you
To become only
The small particle
Drinking from your mouth
My own soul"
278,Emotion,KissPoemsYourKissPoembyLoraSeger,"Your kiss, so sweet, so tender.
Your kiss that makes my heart swell.
Your kiss that drives me into unknown passion.
Your kiss that makes my stomach flutter.
Your kiss that makes me know I'm loved by you.
Your kiss that is unhesitant to be bestowed upon me.
Your kiss that sends me into a poetic bliss."
279,Emotion,KissPoemsAeFondKissPoembyRobertBurns,"1     Ae fond kiss, and then we sever;
2     Ae fareweel, and then forever!
3     Deep in heart-wrung tears I'll pledge thee,
4     Warring sighs and groans I'll wage thee.
5     Who shall say that Fortune grieves him,
6     While the star of hope she leaves him?
7     Me, nae cheerfu' twinkle lights me;
8     Dark despair around benights me.
9     I'll ne'er blame my partial fancy,
10   Naething could resist my Nancy;
11   But to see her was to love her;
12   Love but her, and love forever.
13   Had we never lov'd sae kindly,
14   Had we never lov'd sae blindly,
15   Never met--or never parted--
16   We had ne'er been broken-hearted.
17   Fare thee weel, thou first and fairest!
18   Fare thee weel, thou best and dearest!
19   Thine be ilka joy and treasure,
20   Peace. enjoyment, love, and pleasure!
21   Ae fond kiss, and then we sever;
22   Ae fareweel, alas, forever!
23   Deep in heart-wrung tears I'll pledge thee,
24   Warring sighs and groans I'll wage thee!"
280,Emotion,KissPoemsWithKissPoembyOtteriSelvakumar,"What is
kiss...?
kiss is
Love...?
kiss is
A sex...
Kiss is..
Gift...
Kiss is
funney...
Kiss is
a body smile...
Kiss is
wonder...
Kiss is
What...?
What is
Kiss...?
Kissing thing...
Kisser thing...
That's all for
Kiss...
You wanted kiss...
You kiss another one...
ok...
kiss it...
Or kiss me...
With kiss..."
281,Emotion,KissPoemsTheKissPoembyCoventryPatmore,"'I saw you take his kiss!' ''Tis true.'
'O, modesty!' ' 'Twas strictly kept:
He thought me asleep; at least I knew
He thought I thought he thought I slept.'"
282,Emotion,KissPoemsThisKissPoembyMichaelJBurt,"this kiss wasn’t just a kiss
this kiss was the demise of eternal bliss
this kiss wasn’t just a second of meaningless feelings
this kiss was the end of priceless beginnings
this kiss wasn’t just a thing you had to do
this kiss was the duration of me and you
this kiss…this kiss…this kiss"
283,Emotion,KissPoemsFirstKissPoembyShellyPrice,"Closed eyes can see,
lips upon lips.
Thoughts empty of resistence,
bodies filled with urgency.
Hunger turns into a beast,
without hesitation.
Closer than close,
lips brush lips.
Electricity surges,
lightning strikes the sky.
Tongues seductively dance,
harmonous with the sounds of lust.
Passion consumes,
lips tasting, feeling, teasing, yearning,
urgent to satisfy the starvation of time.
Tongues gently licking wet lips,
sucking.
Bodies are alive,
buring with heat.
All reason cast aside.
The sheer pleasure of a oneness,
feverish,  passionate, wanting more.
More pleasure,
more hot steamy,
wet tongues flickering.
Slowly parting gazing eye to eye,
the purist truths exposed.
Nothing hidden in the instant
that we first kissed."
284,Emotion,KissPoemsTheAngelsKissPoembyBanjoPaterson,"An angel stood beside the bed
Where lay the living and the dead.
He gave the mother -- her who died --
A kiss that Christ the Crucified
Had sent to greet the weary soul
When, worn and faint, it reached its goal.
He gave the infant kisses twain,
One on the breast, one on the brain.
""Go forth into the world,"" he said,
""With blessings on your heart and head,
""For God, who ruleth righteously,
Hath ordered that to such as be
""From birth deprived of mother's love,
I bring His blessing from above;
""But if the mother's life he spare
Then she is made God's messenger
""To kiss and pray that heart and brain
May go through life without a stain.""
The infant moved towards the light,
The angel spread his wings in flight.
But each man carries to his grave
The kisses that in hopes to save
The angel or his mother gave."
285,Emotion,KissPoemsKissOfDeathPoembyjibinjoseph,"No one to stop you
Even you can’t deny
The world will miss you
But you can’t delay
You be gone forever
People remember your deeds
In our heart you will live forever
You will be always in our dreams
You have left our footprints
Prints of love in our heart
And will stay there till our end
Miserable I am, without my sweetheart
The only constant the only truth
To leave behind all you achieved
If you been here someday you have to leave
Everything it takes the kiss of death
The only constant, the only truth
Kiss of death, death it is…….."
286,Emotion,KissPoemsAKissMayMeanAnythingPoembysamuelnze,"One must not take love wrongly
A kiss may mean anything
Emotion gets physical in different ways
If planted on the head
Think of me always
Is a likely import for a kiss
Planted on the cheeks it calls
For fraternity even in strain
On the back of the hand
What other meaning than adoration
For the one beloved
Or on the feet unreserved worship indeed
It is only when a man
Kisses his wife full on the lips
That romance is exclusively expressed
They lock in passionate embrace
Tumbling to the floor
In throes of devouring passion
Making bashful sounds they will disdain
In the somberness of morning
It is not so I feel for my best friend
With him every touch
Is only a call to truer fraternity
That one heart may sincerely love the other
As unto itself."
287,Emotion,KissPoemsAKissTheReplyParodyAustinDobsonAKissPoembyJonathanROBIN,"I kissed Rose right back
like that, without sorrow,
and a pat on the back
showing on the right track
was my rapid attack
I received on the morrow: -
so why would she pack
and the taxi fare borrow?
3 August 1991
Coppers Killed Me
Coppers killed me when we met,
jumping on the tube I sat in;
Magistrate, who loves to get
treats into your list, put that in!
Say I fought the terror fad,
say that “conscience clear” describes me,
say you’re growing old, don’t add, -
Coppers missed me!
Coppers killed me when we met,
hitting on the seat I sat in;
Acting circumstantial bet
eight hits, three misses, put that in!
Say I sought no terror fad,
say that “from bombs free” describes me,
say I’m growing cold, don’t add, -
Coppers killed me!
../..
Error wracks me today,
terror tracks you tomorrow,
let it be as it may,
pain from plain clothes turned grey.
Should tomorrow replay
such a savour of sorrow: -
what for you, safe today, -
is in store for tomorrow?
I could never fire back
like that, without sorrow,
and eight bullets through back
showed after attack
on the Stockwell tube track.
The report on the morrow: -
was on the wrong tack
did from fantasy borrow!
Terror slew me today,
error you risk tomorrow!
Violence came into play
which my life did waylay -
do you share the dismay
at what might come tomorrow?
There’ll be devil to pay
what excuse will YOU borrow?
August 15 2005"
288,Emotion,KissPoemsAKissTellPoembyMariaSudibyo,"I don’t care
I don’t dare
You’re not mine
But this time
You shouldn’t paint your lips
I shouldn’t find you sleep
You don’t give me a clue
You don’t even move
I just want to stop thinking you
And I get close to your hair
That shiny orange gloss has erased my mind
To forget your millions hate
I can’t escape
I take as mine
So stop the game
You know the end
You still witch queen
That cannot win"
289,Emotion,KissPoemsTwoUntitledPoemsAndAKissPoembyAugustineSebastian,"A room
no music
nobody within
i am out
when i am back
music
no room
Square of
music and tears
square of fear,
erected laugh and murder
The Kiss
i could see
the dagger
and the lightning
of fear
glinted on it
A dropp of tear
i heard the hiss.
A stream of blood
i remember a kiss"
290,Emotion,KissPoemsKissKissPlasticBitchPoembyIwishiwasasinvisableashemademefeel,"i see your mouth,
blowing her a kiss,
tough luck baby,
you can't have this...
cos she's one of them plastics,
with bitchy style,
who think their lives revolve around,
a fuckin nail file....! !
prissy little princess's,
what else is it you do?
besides go on constant prowls,
for more men to screw?
skanky little bitches,
the ones i want to hit! !
your missing out on life,
the most important bit...
see sleeping with the teacher,
will only get you so far! !
it won't get you that high rollers job,
to pay for your pink little car....! !
it won't get you friends,
that always got your back,
and it won't buy you respect,
that is a certain fact..! !
see you think everyone loves you,
but fact is they don't! !
and don't even try to make them fall in love with your plastic ass! !
cos they fuckin won't! !"
291,Emotion,KissPoemsTheHowOfWhyForMissKissKissPoembyDónallDempsey,"As we journey
drift from drift-
-wood to drift-wood
She asks me:
“Where do waves come from? ”
“Who is sky? ”
“How is green?
“Why is water? ”
I do my best(I
a mere father)   to answer
but she is already
listening to a shell
tell of the vast sea
inside her."
292,Emotion,KissPoemsBlissInAKissPoembyJMatthewThacker,"The words i say today make the world fall away
The ring on your finger means your here to stay
The smile on your face lets me know you love me
When i wake up your the first thing i want to see
The look in your eyes make the world go away
The words we say makes my heart skip a beat
The bliss in this kiss is ever so sweet
With your hand in mine
Its not hard to find my very own piece of heaven
Were the angels fly happy and free
There i find you circled by these angles that sing
They sing a song
A melody of bliss in a kiss
Your kiss..."
293,Emotion,KissPoemsKissPoembyErinHanson,"The soft plump faded pink lips
the green eyes looking deep
within the soul.
Friends for a year,
memories that would last a life
time.
Drooping my face towards the
stiff grey concrete.
Angles of today that are,
unheard of.
Never been kissed,
as the wet lips subside,
on there own.
Lonely and loosing love,
crackling the red heart within.
pain as it deteriates.
I want to take the heart beats from your body.
Fill in the gaps of the dried out heart.
catch you when you fall,
and be there when you need
someone to love youthe most.
your first wet smile,
to make yours greater in size.
The kiss you will remember and hold on to,
never letting go.
As i say i love you
you slip away
from me once and for all."
294,Emotion,KissPoemsKissMePoembyErnestineNorthover,"Kiss me and make it seem better,
Kiss me and quiet my heart,
I never once asked for a letter,
Stating you wanted to part.
Kiss me and declare you were wrong dear,
Kiss me and confirm it's okay,
Say all those things that I so want to hear,
And wipe all my tears away.
Kiss me and let's stay together,
Kiss me and pour out the wine,
Sit with me on my sofa of leather,
And say that everything will be fine.
Kiss me and tell me you love me,
Kiss me with passion to spare,
Don't think of leaving, that is my plea
And also my ardent prayer.
Kiss me, I need you so deeply,
Kiss me, what more can I say,
But with reality looming before me,
This dream has just melted away.
©   Ernestine Northover"
295,Emotion,KissPoemsTheHouseOfTheLifeTheKissPoembyDanteGabrielRossetti,"What smouldering senses in death's sick delay
Or seizure of malign vicissitude
Can rob this body of honour, or denude
This soul of wedding-raiment worn to-day?
For lo! even now my lady's lips did play
With these my lips such consonant interlude
As laurelled Orpheus longed for when he wooed
The half-drawn hungering face with that last lay.
I was a child beneath her touch, -- a man
When breast to breast we clung, even I and she, --
A spirit when her spirit looked through me, --
A god when all our life-breath met to fan
Our life-blood, till love's emulous ardours ran,
Fire within fire, desire in deity."
296,Emotion,KissPoemsTheKissPoembyDanteGabrielRossetti,"What smouldering senses in death's sick delay
Or seizure of malign vicissitude
Can rob this body of honour, or denude
This soul of wedding-raiment worn to-day?
For lo! even now my lady's lips did play
With these my lips such consonant interlude
As laurelled Orpheus longed for when he wooed
The half-drawn hungering face with that last lay.
I was a child beneath her touch, -- a man
When breast to breast we clung, even I and she, --
A spirit when her spirit looked through me, --
A god when all our life-breath met to fan
Our life-blood, till love's emulous ardours ran,
Fire within fire, desire in deity."
297,Emotion,KissPoemsAKissaBlissBySonamBhutiaPoembysonambhutia,"Clip clop, clip clop...
Drizzle kisses the parched earth.
By the garlands of glee,
A dreamy eye welcomes thee.
Somnolent crops rejuvenate,
And rejoice in thy mellifluous tune.
Sweep afar then,
Doleful moments...
Which has smeared...
Every sweating forehead,
With paste of famine,
Drought and poverty…
And left everything,
A complete dust bowl…
Clip clop, clip clop...
Drizzle kisses the parched earth."
298,Emotion,KissPoemsKissKissKissPoembyDónallDempsey,"'Oh, hi...'
NO!
'Well, hello...! '
NO!
The mirror is horrified
at these...efforts...
to appear
eh...natural?
(when I am anything but
...on tenterhooks) .
Terrified, I pretend
once again...
can't seem to find
a single word
that seems ok!
The mirror laughs
at my pathetic attempts
& 4 changes of tie & jacket.
On the other side of town
you too
talk to your mirror.
'Fancy meeting you here...'
you lie to your reflection
(who is not taken in
by your studied non-cha-lence) .
'What a nice surprise...'
the mirror refuses to be
your accomplice
and doesn't approve
any of your choice of dresses.
The only one it appears to like
is the one with the busted zip
(the one you said you'd fix
sometime last week but
...didn't?)
and now there isn't
any time!
The mirror copies
your tears.
Later that night
on the street
(we both look
awkwardly natural)
as we apparently
meet
by accident...coincidence?
Yeah...right!
I start to say:
'Hi...oh...! '
as you try to articulate:
'Well, fancy you...'
We stop.
Stare.
Let go
of the words
let go
& just
kiss
kiss
kiss."
299,Emotion,KissPoemsAKissPoembyDavidTaylor,"Sweetness is on your lips
like honey flavoured early morning dew.
And your eyes have a depth of blue
that even deepest oceans cannot match
with a twinkling like the stars that flash
across the space between
in which our sight it seems is seen.
And your hair as in a gentle breeze
It takes each fine strand and wisps it
on the air as if a string that music makes
deep within, a heartfelt ring.
And your smile a glowing
and in its glowing knowing
that this is true love that’s surely flowing.
Our eyes melt into one
and lips they coalesce
arms embrace entwined.
Love flows and joins
and what seemed a seeming two
are known as one, no longer me and you.
And all the Angels stop and stare
the stars in their travels pause
the sands of time suspend their race
the universe so vast in space
becomes a very tiny place.
Because love flows and joins
this is Love’s gift to all
to know you are so vast, not small
joined in abundant bliss
that’s truly universal
and found in just one loving kiss."
